8,경제,"서울지하철 이어 철도노조도 파업 철회, '손실액 1.6조' 화물연대는?","                ━            입환업무 '3인1조' 합의, 통상임금 인건비 포함 배제              ━              이날 노사 간 협상이 타결됨에 따라 오전 9시로 예고됐던 파업은 전면 철회됐다. 모든 열차가 정상 운행하게 됐다.                            ━            코레일·서울교통공사 잇단 파업철회… 화물연대는?              ━              이날 임단협 잠정 합의안은 오후 3시 조합원의 인준 투표를 거쳐 최종 타결 여부가 결정된다. 파업이 철회됨에 따라 화물연대 파업에 이어 철도까지 마비되는 최악의 물류대란 우려는 덜게 됐다. 박인호 철도노조 위원장은 ""지금까지 지켜봐 주신 시민 여러분에게도 감사드린다. 더 안전하고 편리한 공공철도로 보답하겠다""고 밝혔다.             전국철도노동조합이 2일로 예고했던 파업을 철회했다. 철도노조와 한국철도공사(코레일)는 1일 밤부터 2일 새벽까지 교섭 끝에 4시 30분쯤 임금·단체협상에 잠정 합의했다. 철도 노사 간 합의에는 이태원 참사의 충격이 가시지 않은 가운데 파업으로 열차 혼잡이 심화되면 자칫 여론이 악화될 수 있다는 부담이 작용한 것으로 보인다. 앞서 지난 30일 서울교통공사가 파업 하루만에 파업을 철회한 것도 영향을 미쳤다.  노조는 사측과의 교섭에서 △임금 월 18만7000원 정액 인상 △승진포인트제 도입을 통한 투명한 승진제 시행 △법원의 통상임금 지급 판결로 늘어나는 급여의 인건비 포함 배제 △노사 합의에 따른 성과급 지급기준 현행 유지 등을 요구했다. 철도노조는 협상의 최대 쟁점이었던 통상임금 항목 확대에 따른 실적급 증가분을 3년에 걸쳐 단계적으로 해소하는데 합의했다. 이에 따라 기획재정부는 코레일에 대해 2022년부터 발생할 '실적급 증가분'을 총인건비 외 별도 지급할 수 있도록 승인키로 했다. 의왕 오봉역 직원 사망사고와 관련, 열차를 분리하거나 결합하는 '입환 업무'는 2인 1조가 아닌 3인 1조로 작업하도록 인력을 충원하는데도 합의했다. 전체 코레일 역사 중에서도 작업환경이 열악한 오봉역은 코레일이 구내 작업환경을 장단기적으로 개선하기로 했다. 코레일이 사고의 책임을 통감하고 유가족에게 공식 사과 입장을 표명하는 한편 관련 책임자는 문책하기로 했다. 또 다른 쟁점이었던 승진 제도와 관련해선 중앙노동위원회의 권고안을 수용해 3급 승진은 2028년부터, 4급과 5급 승진은 2025년부터 도입키하는데 합의했다. 현행 서열명부 방식을 폐지하고 객관적 평가요소별 포인트(승진포인트제)를 합산하는 방식으로 개선하기로 했다. 코레일과 서울교통공사가 노사 합의로 파업을 철회하자 9일째 파업을 잇고 있는 화물연대는 고립되는 양상이다.  시멘트, 정유, 철강 등 화물연대 파업에 따른 손실액은 1주일 간 1조6000억원에 육박하는 것으로 추산된다. 이에 국토교통부는 지난달 29일 시멘트 분야 운송 거부자에게 업무개시명령을 발동하고 안전운임제 폐지 가능성까지 언급한 상태다.  이번 주말이 화물연대 파업의 분수령이 될 것이란 전망이 우세하다. 정부 관계자는 ""휴일을 낀 주말에 노조의 집결율이 낮아지는게 일반적인데 오늘까지 업무개시명령서 송달도 마무리돼 업무 복귀에 대한 압박이 높아질 수 있다""고 했다.  김희정 기자 dontsigh@mt.co.kr <저작권자 ⓒ '돈이 보이는 리얼타임 뉴스' 머니투데이, 무단전재 및 재배포 금지>",머니투데이,https://t1.daumcdn.net/news/202212/02/moneytoday/20221202103439626dfqj.jpg,https://v.daum.net/v/20221202103437807,1
8,경제,코레일 노사 임금·단협 개정 잠정 합의…철도노조 파업 철회," 한국철도공사(코레일) 노사가 밤샘 협상 끝에 임금·단체협상 개정에 잠정 합의했습니다. 이에 따라 전국철도노동조합이 오늘(2일) 오전 9시부터 시작한다고 예고한 파업은 철회했습니다. 앞서 어제 오후 4시 20분쯤 본교섭에 들어갔던 코레일 노사는 20분 만에 대화를 중단했고, 7시간여만인 밤 11시 50분쯤 다시 실무 협상을 재개했습니다.  노사는 정회를 거쳐 새벽 3시부터 다시 협상을 이어간 끝에 새벽 4시 30분쯤 임금·단체협상 개정에 잠정 합의했습니다. 노사는 우선 법원의 통상임금 지급 판결로 늘어나는 급여에 대해 3년 동안 단계적인 해소 방안을 마련하기로 했습니다.  또, 직원 사망사고가 발생한 경기도 의왕시 오봉역에서 3인 1조로 입환작업이 가능하도록 인력을 충원하고, 작업 환경을 개선하기로 합의했습니다.  이와 함께 오봉역 사망사고 유가족에게 코레일이 공식 사과하기로 했습니다.  김선욱 철도노조 정책실장은 잠정 합의 후 기자들과 만나 ""오늘 오후에 전국 지부장 회의가 소집될 예정이고, 일주일 안에 조합원 총회를 열어 잠정 합의안에 대한 찬반투표를 진행한다""고 설명했습니다.  극적 합의로 파업은 철회됐지만, 이미 주요 열차 편성이 변경된만큼 모든 열차가 정상화되기까지는 시간이 걸릴 전망입니다.  코레일 관계자는 ""정확한 열차 운행 정보는 코레일 홈페이지나 모바일 앱을 통해 확인해달라""고 설명했습니다. [사진 출처 : 연합뉴스] 박영민 기자 (youngmin@kbs.co.kr)",KBS,https://t1.daumcdn.net/news/202212/02/kbs/20221202045654786hsak.jpg,https://v.daum.net/v/20221202045257388,1
8,사회,한국철도 노사 밤샘 협상 잠정 합의," 한국철도 노사가 2일 코레일 서울 사옥에서 밤샘 협상을 벌인 끝에 올해 임금·단체협상 개정에 잠정 합의했다고 밝혔다.            [이동근 기자(brk606@naver.com)] 이에 따라 오전 9시 시작을 예고한 파업은 철회되고, 모든 열차가 정상 운행하게 되며 이용객들은 시름을 덜게 됐다. 앞서 철도노조는 지난 10월26일 조합원 총투표를 벌여 조합원 61.1% 찬성률로 쟁의행위 돌입을 결정했다. 또 노조는 지난달 24일부터는 이른바 ‘준법투쟁(태업)’을 진행하며 사측과의 교섭에서 임금 월 18만7000원 정액 인상, 승진포인트제 도입을 통한 투명한 승진제 시행, 법원의 통상임금 지급 판결로 늘어나는 급여의 인건비 포함 배제, 노사 합의에 따른 성과급 지급기준 현행 유지 등을 요구했다. 이에 사측은 올해 임금 총액 대비 1.4%로 정해진 기획재정부의 공공기관 인건비 지침 범위를 넘어설 수 없고 통상임금 증가분의 인건비 제외 요구 등 대부분의 요구도 기재부 지침에 어긋나 수용하기 어렵다고 맞서며 교섭이 난항을 겪었다. 하지만 철도 노사는 밤샘 협상에서 이들 쟁점에 의견 접근을 이룬 끝에 오전 5시쯤 협상을 타결했다. 한편, 철도 노사의 잠정 합의에는 이태원 참사의 충격이 가시지 않은 가운데 파업을 강행할 경우 수도권 전철의 감축 운행과 극심한 열차 내 혼잡이 불가피하며, 이로 인한 여론 악화에 대한 노조의 부담이 컸던 점이 작용한 것으로 보인다. 서울교통공사 노조가 지난달 30일 파업 돌입 후 하루 만에 파업을 철회한 것도 영향을 준 것으로 관측된다. 철도노조가 파업을 강행할 경우 화물연대 파업으로 이미 가시화된 물류대란과 산업계의 타격이 더 심화하고, 주말 대입 수시 수험생들의 불편이 우려됐으나 이날 잠정 합의로 최악의 상황은 피하게 됐다. [이동근 기자(brk606@naver.com)]",프레시안,https://t1.daumcdn.net/news/202212/02/pressian/20221202111226189qgmj.jpg,https://v.daum.net/v/20221202111224399,1
8,사회,코레일-철도노조 밤샘 교섭 끝 극적 합의…오전 중 단계적 정상운행(종합),"(서울=뉴스1) 김진 김도엽 기자 = 전국철도노동조합(이하 철도노조)의 총파업이 예고된 2일 노사가 밤샘 협상 끝에 극적으로 임금·단체교섭에 잠정 합의하며 파업이 철회됐다.  이날 한국철도공사(코레일과) 철도노조에 따르면 노사는 오전 4시30분쯤 코레일 서울사옥에서 진행된 임금·단체교섭에 잠정 합의안을 도출했다.  철도노조는 ""임단협 잠정합의가 도출됨에 따라 준법투쟁(태업) 및 총파업 준비지침을 해제한다""고 밝혔다.  이에 따라 이날 오전 9시부터 시작될 예정이었던 철도노조의 총파업은 철회됐다. 열차 운행은 이날 오전 중 단계적으로 정상화가 이뤄질 전망이다. 철도는 필수유지사업장으로, 코레일은 총파업에 대비해 대체인력을 투입하고 운행률을 조정한 바 있다. 코레일 관계자는 ""열차 계획이 (출근시간대) 89.6%로 짜여진 상황""이라며 ""바로 100% 운행이 되면 혼란이 있을 수 있어 완전 정상화에는 시간이 걸릴 것""이라고 설명했다.  노사는 전날 오후 4시20분 본교섭을 실시했으나 20분 만에 입장차만 확인한 채 교섭을 정회했다.  본교섭은 오후 11시50분쯤 재개됐고 2일 오전 1시30분쯤 다시 정회됐다. 노사는 3시쯤 실무교섭을 거쳐 본교섭을 재개했고 1시간 30여분 만에 잠정합의안을 도출했다.  철도노조의 요구사항은 △임금 월 18만7000원 정액 인상 △승진포인트제 도입을 통한 승진제 시행 △법원 통상임금 지급 판결로 늘어나는 급여의 인건비 포함 배제 △노사합의에 따른 성과급 지급기준 현행 유지 등이다.  노사는 이 가운데 통상임금 판결에 따른 인건비 문제를 놓고 가장 큰 입장차를 보인 것으로 전해졌다. soho0902@news1.kr ",뉴스1,https://t1.daumcdn.net/news/202212/02/NEWS1/20221202053428031dadm.jpg,https://v.daum.net/v/20221202053427256,1
8,사회,"대화 대신 조사, 협상 대신 협박···공정위까지 동원해 화물파업 압박","정부가 화물연대 총파업을 비롯한 올겨울 노동쟁의 전반에 대해 전방위적인 강경 대응을 이어가고 있다. 정부는 기업의 불공정행위를 감독하는 기구인 공정거래위원회까지 동원해 현장조사를 통해 화물연대를 압박했다. 정유·철강·컨테이너 화물기사들에게는 추가적인 업무개시명령도 시사했다. 노동계는 정부의 이 같은 대응을 노동 탄압으로 규정하며 강력히 반발하고 있다. 화물기사들에게 업무개시명령을 내리면서 한편으로는 ‘개인사업자’로 규정해 조사에 나선 것은 자가당착이라는 지적도 나온다. 건설기계 노동자들은 화물연대 총파업을 지지하며 동조파업에 나섰다. 공정위는 2일 오전 10시 서울 강서구에 있는 민주노총 공공운수노조 화물연대본부 사무실에 조사관 17명을 보내 현장조사를 시도했다. 노조 관계자들과 조사관들이 조사 방법을 놓고 협의가 이뤄지지 않으면서 이날 조사는 이뤄지지 못했다. 노조 측은 “조사 협조 의사가 있지만 현재 상황이 민감하고 조사에 응대할 사람이 없으며, 건물에 입주한 여러 단체들이 동의하지 않아 건물 진입은 어렵다”는 입장이다. 공정위는 지난달 29일부터 화물연대에 대해 공정거래법 위반 여부를 검토하고 있다. 화물연대의 운송 거부가 공정거래법상 ‘부당한 공동행위’와 ‘사업자단체 금지행위’에 해당하는지 살피겠다는 것이다. 공정위는 이날부터 오는 6일까지 주말 제외 3일간을 조사 기간으로 잡았다. 한기정 공정위원장은 이날 정부서울청사에서 브리핑을 열고 “화물연대 본부는 대표부 부재 등을 이유로, 부산지역본부는 파업기간 중 조사를 받을 수 없다는 이유로 현장 진입을 저지하고 있다”며 “고의적으로 현장 진입을 저지·지연하는 행위는 공정거래법상 조사방해 행위에 해당하므로 고의적인 현장 진입 저지가 계속될 경우 고발 등 법과 원칙에 따라 엄정 대응할 것”이라고 말했다. 그러면서 “부당한 공동행위와 사업자단체 금지행위는 합의 등과 관련한 내부 자료가 파기되는 경우 그 위법성을 입증하기가 매우 어려운 측면이 있고, 저희는 조사 방해가 지금 상당히 조직적으로 심각하게 이뤄지고 있다고 판단하고 있다”고 강조했다. 정부는 추가 업무개시명령 가능성까지 시사하며 강경 기조를 이어갔다. 이상민 행정안전부 장관은 이날 정부서울청사에서 중앙재난안전대책본부 회의를 열어 “정부는 정유, 철강, 컨테이너 등 물류대란이 현실화하고 있는 다른 산업 분야에서도 피해가 크게 확산하면 업무개시명령을 즉시 발동할 것”이라고 했다. 정부·여당 정치인들의 ‘입’도 연일 거칠어지고 있다. 원희룡 국토교통부 장관은 지난 1일 페이스북에서 민주노총을 “민폐노총”이라 칭하는 등 강성 발언을 이어가는 중이다. 성일종 국민의힘 정책위의장은 2일 국회에서 열린 국민의힘 원내대책회의에서 “불법 운송거부로 국민을 인질 삼아 민주노총의 이익을 확장하려는 시도는 결코 성공하지 못할 것”이라고 했다. 노동계는 정부가 무리한 노동탄압을 자행하고 있다며 반발하고 있다. 공정위 조사는 화물연대를 ‘사업자단체’로 전제하고 있는데, 개인사업자에게 노동을 강제하는 업무개시명령은 앞뒤가 맞지 않는다는 것이다. 공공운수노조는 이날 성명에서 “화물기사들은 한국이 비준 중인 국제노동기구(ILO) 핵심협약을 통해 노동자의 지위를 보장받고 있으며, 정부로부터 설립신고증을 교부받은 산별노조인 공공운수노조 소속 조합원”이라며 “사업자 혹은 사업자단체의 불공정행위를 규제하기 위한 공정거래법을 노동조합에 적용하는 것 자체가 부당하고 과도한 행정권 남용”이라고 했다. 공공운수노조는 이어 “화물연대를 향한 윤석열 정부의 혐오와 공격이 법과 상식을 넘어 광기에 이르고 있다”며 “이건 정부가 아니라 노조혐오에 찌든 무법자 집단이다. 근거도 명분도 없이 오직 노조혐오에 찌들어 진행되고 있는 정부의 공안탄압 파상공세를 엄중히 규탄하며, 더 완강한 투쟁으로 응대할 것”이라고 했다. 노동계에서는 정치인들의 강성 발언이 갈등을 해소하기는커녕 더 키우고 있다는 지적도 나오고 있다. 양경수 민주노총 위원장은 이날 MBC라디오 ‘김종배의 시선집중’에 출연해 “(원 장관의 발언은)문제 해결의 주체가 오히려 갈등을 조장하고 있는 모양새다. 이런 분이 국무위원 장관직을 맡고 있다는 현실이 참 서글프다”며 “이태원 참사 등으로 지지기반이 흔들리는 상황에서 모든 문제를 다 민주노총에게 뒤집어씌우며 보수세력 결집을 꾀하는 것으로 본다”고 했다. 화물연대 총파업의 여파를 겪고 있는 건설산업 노동자들은 화물연대를 지지하며 동조파업에 나설 것이라고 밝혔다. 민주노총 전국건설노동조합은 이날 서울 영등포구 건설노조 사무실에서 긴급 기자회견을 열어 “정부는 화물연대 파업으로 건설일용노동자들이 일손을 놓게 된다며 노노갈등을 유발하고 있다”며 “우리는 안전운임제 확대를 위한 화물연대 파업을 지지한다”고 밝혔다. 건설노조는 이어 “시멘트가 없어 당장 일 못한다고 울상짓는 게 아니라, 건설현장을 멈춰서라도 화물연대의 투쟁에 함께 승리하겠다”고 했다. 송찬흡 건설노조 건설기계분과위원장은 “30년 넘게 현장에서 덤프를 운전하며 누구보다 화물노동자들의 처지를 잘 알고 있다”며 “화물노동자들이 안전하게 운송을 해줘야 우리의 일도 돌아간다. 같은 특수고용노동자로서 화물노동자들에 대한 탄압을 더 이상 두고 볼 수 없다”고 했다. 조해람 기자 lennon@kyunghyang.com, 반기웅 기자 ban@kyunghyang.com",경향신문,https://t1.daumcdn.net/news/202212/02/khan/20221202161650778abvd.jpg,https://v.daum.net/v/20221202161649770,0
8,경제,화물연대 파업이 ‘사업주 담합’이라는 공정위…“ILO 협약 위배” 비판,"공정거래위원회가 민주노총 공공운수노조 화물연대본부(화물연대) 파업에 대해 ‘사업자 단체 금지행위’ 위반 여부를 가리겠다며 직권으로 현장조사에 착수했다. 화물연대를 노동조합이 아닌 사업자 단체로 규정해 공정거래법상 부당 공동행위로 처벌하겠다는 것이다. 세계적으로 특수고용노동자의 노동권을 강화하는 기조와 우리 정부가 비준한 국제노동기구(ILO)의 협약을 정면으로 거스르는 것이란 비판이 나온다. 공정거래위원회는 2일 오전 서울 강서구 공공운수노조 사무실과 부산 남구 화물연대 부산지역본부에 조사관 17명을 보냈다고 밝혔다. 공정위 관계자는 “소속 사업자에 대한 운송거부 강요 행위, 다른 사업자의 운송을 방해하는 행위 등을 살피기 위한 위한 현장 조사”라고 설명했다. 지난달 29일 법 위반 여부를 검토하겠다고 밝힌 뒤 사흘 만에 전격 조사에 나선 것이다. 공정위는 이날부터 사흘 동안 관련 자료와 진술을 받겠다는 입장이지만, 조합원들의 제지로 건물에 들어서지 못하고 대치했다. 화물연대 관계자는 “공정위 직원들은 담합의 내용이 무엇인지조차 설명하지 않고 일단 (사무실 안에) 들어가야 한다는 말만 되풀이했다. 조사가 목적인지, 사무실에 들이닥치는 것이 목적인지 알 수 없을 지경”이라고 말했다. 화물연대는 공정위 조사가 부당하다고 판단하지만 장소·방법을 조율해 조사에 응할 방침이다. 한기정 공정거래위원장은 이날 별도의 브리핑을 열어 “화물연대에 소속된 화물차주를 사업자로 판단하고 있으며, 향후 파업이 종료될 시에도 법 위반 여부에 대한 조사는 계속 진행할 계획”이라고 말했다. 이어 “고의적으로 현장 진입을 저지·지연하는 조사 방해행위는 심각한 문제”라며, 조사 방해에 대해서도 강경 대응 방침을 밝혔다.  정부가 화물차 기사 등 특수고용노동자를 노동자와 노동조합이 아닌 사업주와 사업자 단체로 규정하는 것은 상당한 논란이 일 것으로 보인다. 공정위는 지난 6월에도 민주노총 건설노조의 굴착기 기사 등 특수고용노동자들이 건설사에 압력을 행사한 쟁의 행위를 ‘불공정거래행위 강요’로 판단해 전원회의에 넘겼다. 당시 공정위는 건설노조 간부 중에 건설기계를 여러대 등록하고 임대하는 사업자들이 있다는 점을 문제삼았는데, 화물연대 조합원은 모두 개인·지입 차주여서 사정이 다르다.  한국 정부가 비준해 국내법과 동일한 효력을 갖는 국제노동기구(ILO) ‘결사의 자유 협약’에 위반된다는 지적도 피할 수 없다. 국제노동기구 ‘결사의 자유 위원회’는 2011년부터 화물연대 파업 관련 제소 사건에서 “화물기사들은 자신의 선택에 따라 노조법에 의해 설립된 단체를 포함해, 자신의 이익을 증진하고 보호할 단체에 가입할 권리가 있다”고 권고해왔다. 윤애림 서울대 법학연구소 책임연구위원은 “전 세계적으로 자영노동자(특수고용노동자)에 대해선 경쟁법을 적용하지 않겠다는 기조인데, 현 정부는 오히려 특수고용노동자의 노동기본권을 위축시키고 있다”고 말했다. 김회승 선임기자 honesty@hani.co.kr 박태우 기자 ehot@hani.co.kr 옥기원 기자 ok@hani.co.kr",한겨레,https://t1.daumcdn.net/news/202212/02/hani/20221202173515315wzai.jpg,https://v.daum.net/v/20221202172505512,0
8,사회,대통령·여당·중대본·경찰에 공정위까지…화물연대 전방위 압박,"민주노총 전국공공운수사회서비스노동조합 화물연대본부(화물연대)의 파업이 9일째를 맞은 2일, 정부·여당이 전방위적인 탄압을 이어가고 있다. 물류 현장은 비조합원들의 업무 복귀가 가시화되는 등 화물연대 파업에 불리한 상황으로 돌아가고 있지만, 협상 창구마저 없는 화물연대는 파업을 지속할 수밖에 없는 실정이다. 노사관계 전문가들은 물류대란 장기화와 사회적 갈등을 최소화하기 위해 국회·시민사회 등이 중재에 나서야 한다고 지적한다. 윤석열 대통령은 2일 “불법과 범죄를 기반으로 하는 쟁의행위에는 끝까지 법적 책임을 묻겠다”며 화물연대 파업에 엄정대응하겠다는 태도를 굽히지 않았다. 김은혜 대통령실 홍보수석은 이날 용산 대통령실에서 브리핑을 열어 “윤 대통령이 쇠구슬로 무장하고 공장 진‧출입로를 차단하며 집단행동에 참여하지 않는 종사자에 대한 불이익과 협박 상황이 나아지지 않고 있음을 보고 받았다”며 이렇게 전했다. 대통령실 고위 관계자는 이날 기자들과 만나 “집단행동 과정에서 일체의 강요와 폭행은 물론, 집단행동에 가담하지 않는 사람에 보복을 벼르는 일체의 불법에 대해 예외 없이 민형사상 책임을 묻겠다는 각오”라고 말했다. 이날 경찰은 지난달 26일 부산신항에서 비조합원 화물차량에 쇠구슬을 쏜 사건과 관련해 화물연대 조합원 3명 전원을 체포하는 등 수사를 본격화하고 있다. 이에 더해 이상민 행정안전부 장관은 이날 오전 중앙재난안전대책본부(중대본) 회의에서 “정유·철강·컨테이너 등 물류대란이 현실화되고 있는 다른 산업 분야에서도 피해가 크게 확산되면 업무개시명령을 즉시 발동할 것”이라며 시멘트 분야에 내려진 업무개시명령을 확대할 것임을 시사했다. 특히 공정거래위원회는 같은 날 오전 전례없이 화물연대를 상대로 ‘사업자단체 위반행위’를 조사하겠다고 나서, 행정권 남용이라는 비판을 받고 있다. 여당은 이날 열린 안전운임제 법안 논의엔 불참하면서도 연일 화물연대와 민주노총에 대한 비난발언을 쏟아냈다. 화물연대가 가입된 공공운수노조는 성명을 통해 “공정위 조사는 윤석열 정부의 화물연대를 향한 혐오와 공격이 법과 상식을 넘어 광기에 이르고 있다는 점에서 크게 우려된다”며 “근거도 명분도 없이 진행되는 공안탄압 파상공세에 더 완강한 투쟁으로 응대할 것”이라고 밝혔다.  파업이 장기화되면서 화물연대 내부 상황은 그리 녹록치 않은 것으로 전해지고 있다. 조합원의 파업은 대부분 유지되고 있지만, 함께 했던 비조합원들이 운송사의 압박과 생계 문제로 업무에 복귀하면서 ‘업무의 저해’를 바탕으로 한 화물연대의 교섭력이 떨어질 수 있다. 화물연대는 협상을 통해 극한 대치 상황을 해소할 의지가 있지만, 정부가 대화와 타협의 여지를 주지 않음에 따라 전날 저녁 열린 중앙집행위원회에서 파업을 지속하기로 결정한 것으로 알려졌다. 전국건설노동조합이 화물연대를 지지하며 동조파업에 나서겠다고 밝히는 등 민주노총 차원의 연대투쟁도 잇따르고 있다. 노동계에선 제3자 중재를 통한 사태 해결이 필요하다는 지적이 나온다. 이병훈 중앙대 교수(사회학)는 “정부가 누른다고 해서 화물연대가 굴복하지 않을 뿐만 아니라 사태가 장기화될수록 사회적 갈등에 따른 부담도 커진다”며 “안전운임제 일몰을 유예한 상태에서 시민사회단체 등 제3자가 중재에 나서 국회와 정부, 화물연대 등을 포함한 정책협의기구를 통해 논의하는 것도 방법이 될 수 있다”고 말했다. 정흥준 서울과학기술대 교수(경영학)도 “택배 파업 당시 사회적기구를 만들어 타협했던 것처럼, 국회·국토교통부·시민사회단체·이해당사자들이 참여하고 논의를 강제할 수 있는 공식기구를 만들어 안전운임제 관련 논의를 지속하는 방안도 검토할 필요가 있다”고 밝혔다.  박태우 기자 ehot@hani.co.kr 배지현 기자 beep@hani.co.kr 김선식 기자 kss@hani.co.kr",한겨레,https://t1.daumcdn.net/news/202212/02/hani/20221202174022541zxze.jpg,https://v.daum.net/v/20221202172508514,0
