18,경제,11월 소비자 물가 5%↑…“당분간 5% 수준 유지 전망”,"            촬영기자:김현태/영상편집:김대범                       [앵커] 지난달 소비자 물가가 5% 상승하며, 전달보다 상승 폭을 크게 줄였습니다. 농축수산물과 석유류 가격의 오름세가 둔화한 영향이 컸는데, 다만 5%대 높은 물가 상승률은 당분간 유지될 거란 전망이 우세합니다. 이승훈 기자가 보도합니다. [리포트] 통계청이 집계한 지난달 소비자 물가는 1년 전과 비교해 5% 올랐습니다. 전달과 비교하면, 상승 폭은 0.7%p가량 축소됐습니다. 소비자 물가는 지난 7월 6.3%로 최고점을 기록한 뒤 5% 중후반대에 머물다. 지난달 5%까지 내려왔습니다. 품목별로 보면 농축수산물의 가격이 0.3% 오르면서 5% 넘게 올랐던 전달보다 상승 폭을 크게 줄였습니다. 특히 채소류 가격은 2.7% 하락했습니다. 석유류도 상승 폭이 많이 둔화했습니다. 석유류 가격 상승률은 지난 7월 35%에서 8월 들어 10%대로 내려왔고, 11월 조사에선 5.6%까지 낮아졌습니다. 반면 가공식품 가격은 9.4% 올랐고, 외식비도 8% 넘게 상승했습니다. 10월 요금 인상의 여파로 전기 가스 수도 요금도 23% 넘게 올랐습니다. 변동 폭이 큰 농산물과 석유류 등을 뺀 근원물가는 전달과 같은 4.8%로 2009년 2월 이후 가장 높은 수준을 그대로 유지했습니다. [어운선/통계청 경제동향통계심의관 : ""(소비자 물가가) 전월대비 하락한 것 자체는 의미있게 볼 측면이 있다고 생각하고 있습니다. 상방 요인과 하방 요인이 모두 있기 때문에 다음 달에도 이 수준에서 등락할 것으로 생각하고 있고요.""] 한국은행은 농산물과 석유류 가격이 지난해 큰 폭으로 오른 기저효과로 소비자 물가 상승률이 크게 둔화했다고 진단했습니다. 국제 유가 변동성 등을 고려할 때 내년 초까지 5% 수준의 높은 오름세가 이어질 가능성이 높다고 내다봤습니다. KBS 뉴스 이승훈입니다.  이승훈 기자 (hun21@kbs.co.kr)",KBS,https://t1.daumcdn.net/news/202212/02/kbs/20221202123752086iwvx.png,https://v.daum.net/v/20221202123751680,1
18,경제,11월 소비자물가 5% 상승…한 달 만에 0.7%P 하락,"11월 국내 소비자물가가 지난해 같은 달에 견줘 5% 올랐다. 물가 상승폭이 10월 5.7%에서 둔화한 것이다. 채소값과 유가의 안정세 영향이다. 통계청은 향후 경기 둔화 등에 따라 물가 오름세가 주춤할 것으로 내다봤다.  통계청이 2일 발표한 ‘2022년 11월 소비자물가 동향’을 보면, 지난달 소비자물가 지수는 109.1(2020년=100)로 지난해 11월에 견줘 5% 상승했다. 지난해 같은 기간 대비 물가 상승률이 10월 5.7%에서 0.7%포인트 축소된 것이다. 앞서 국내 물가 상승률은 5월 5.4%에서 6월 6%로 올라선 뒤 7월 6.3%, 8월 5.7%, 9월 5.6%, 10월 5.7%를 기록했다. 지난 7월 고점을 찍고 상승률이 낮아지는 모습이다. 그러나 지난달 물가 상승률은 11월 기준으로는 1998년 11월(6.8%) 이후 24년 만에 가장 높은 수준이다. 품목별로는 가공식품·석유류 등 공업제품이 지난해 같은 달에 견줘 5.9% 상승했다. 다만, 상승 폭은 10월보다 0.4%포인트 줄었다. 휘발유·경유 등 석유류 가격 상승률이 10월 10.7%에서 11월 5.6%로 둔화한 영향이다. 석유류의 지난달 물가 상승 기여도도 한 달 전보다 0.23%포인트 축소되며 전체 물가 상승 폭의 둔화를 이끌었다.  농축수산물은 전년 대비 0.3% 올랐고, 10월(5.2%)에 견줘서는 상승 폭이 확 꺾였다. 10월 20% 넘게 뛰었던 채소류 가격이 지난달에는 2.7% 내렸다. 지난해 11월 한파로 채소 가격이 워낙 높았던 데 따른 기저 효과와 올여름 장마·폭염 등으로 고공행진하던 채솟값이 조정을 받은 영향이다. 채소류 가격 하락은 10월 대비 물가 오름 폭을 0.4%포인트 줄이는 영향을 미쳤다. 생선·채소·과실 등 신선식품 지수도 0.8% 상승하는 데 그치며, 10월(11.4%)보다 오름 폭이 크게 둔화했다.  반면 전기·가스·수도(23.1%)는 10월과 같은 높은 상승세를 이어갔다. 공공요금은 전체 물가를 0.77%포인트 밀어올렸다. 서비스(4.1%)도 4%대 상승률을 유지했다.  수요 쪽 물가 상승 압력은 여전히 높은 수준이다. 계절 변화나 일시적인 수급 충격 등으로 가격이 들쭉날쭉한 품목을 제외한 ‘농산물 및 석유류 제외 지수’는 11월 4.8% 오르며, 10월과 같은 상승률을 기록했다. 경제협력개발기구(OECD) 기준을 반영한 ‘식료품 및 에너지 제외 지수’ 상승률은 10월 4.2%에서 11월에는 4.3%로 확대됐다. 소비자가 자주 많이 구매하는 품목 144개 가격을 조사한 생활물가 지수는 지난해 같은 달에 견줘 5.5% 올랐다. 다만, 지수 상승폭은 10월보다 1%포인트 축소됐다.  어운선 통계청 경제동향통계심의관은 “12월 물가도 11월 수준에서 등락할 것으로 보인다”며 “내년엔 경기 둔화 등으로 수요 쪽 물가 상승 압력이 커지지 않을 것으로 예상되는 만큼 공급 측면의 악재가 없다면 올해보다 안정세를 보일 것으로 기대한다”고 말했다.  이환석 한국은행 부총재보는 이날 열린 물가 상황 점검 회의에서 “소비자물가는 내년 초까지 5% 수준의 오름세를 이어갈 것”이라며 “국제유가 등 원자재 가격 추이의 불확실성이 큰 가운데, 경기 둔화 폭 확대 가능성 등은 물가 하락 요인, 에너지 요금 인상 폭 확대 가능성 등은 상승 요인이 될 수 있다”고 짚었다. 박종오 기자 pjo2@hani.co.kr",한겨레,https://t1.daumcdn.net/news/202212/02/hani/20221202101012723agtk.jpg,https://v.daum.net/v/20221202100011316,1
18,경제,"(영상)물가 고공행진...한은 ""내년 초까지 물가 5%대 오름세""","            [이데일리 문다애 기자] 최근 넉달 연속으로 소비자물가 상승률이 5%대를 보인 가운데, 한국은행이 내년 초까지 이러한 오름세가 이어질 것으로 전망했습니다.            한은은 오늘(2일) 이환석 부총재보 주재로 ‘물가 상황 점검회의’를 개최해 물가상황과 향후 물가 흐름을 점검했습니다. 통계청에 따르면 지난달(11월) 소비자물가는 5.0% 올라, 넉 달 연속 5% 상승률을 보였습니다. 같은 달 기준으로는 1998년 이후 24년 만에 최대 상승률입니다. 이환석 부총재보는 “농산물·석유류 가격이 지난해 큰 폭으로 오른 데 따른 기저효과 등으로 소비자물가 상승률이 상당폭 둔화했는데 이는 지난주 전망 당시의 예상에 부합하는 수준”이라고 진단했습니다. 이어 “소비자물가는 내년 초까지 5% 수준의 오름세를 이어갈 것으로 예상한다”며 “경기둔화폭 확대 가능성 등이 하방리스크로, 에너지요금 인상폭 확대 가능성 등은 상방리스크로 각각 잠재해 있다”고 내다봤습니다. 또한 “두바이유 기준 국제유가는 글로벌 경기침체 우려로, 지난달 하순 배럴당 70달대까지 하락했으나, 최근 미 원유 재고 급감, 중국 방역 조치 완화 기대 등으로 80달러대로 반등하는 등 변동성이 확대되고 있다”고 덧붙였습니다. 문다애 (dalove@edaily.co.kr) ",이데일리,https://t1.daumcdn.net/news/202212/02/Edaily/20221202165929305elpt.jpg,https://v.daum.net/v/20221202165925842,1
18,경제,한은 “물가 내년 초까지 5% 오름세”...기준금리 오르나," 한국은행은 2일 물가가 내년 초까지 5% 수준의 오름세를 이어갈 것으로 전망했다. 내년 1월 추가 금리 인상이 예상되는 대목이다.            한은은 이날 서울 중구 한은 본관에서 이환석 한국은행(한은) 부총재보 주재로 ‘물가 상황 점검회의’를 열었다고 밝혔다. 통계청이 같은날 발표한 '11월 소비자물가 동향'을 보면 소비자물가지수는 109.10(2020=100)을 기록해 1년 전보다 5.0% 올랐다. 상승률은 10월보다 0.7%p(포인트) 떨어졌다. 상승률이 하락했지만 소비자물가는 4개월 연속 5%대를 기록했다.  품목별로 보면 농축수산물 가격이 0.3% 올라 10월(5.3%) 보다 상승률이 크게 떨어졌다. 농산물이 2.0%, 채소류는 2.7% 하락했고, 축산물은 1.1%, 수산물은 6.8% 올랐다. 반면 공업제품은 5.9%, 석유류는 5.6%, 가공식품은 9.4% 각각 올랐다. 여기에 전기·가스·수도는 23.1% 상승했다. 농산물 및 석유류를 제외한 근원물가는 1년 전보다 4.8% 상승했다. 근원물가 지수는 계절적 요인이나 일시적 충격에 의한 물가 변동분을 제외하고 장기적인 추세를 파악하기 위해 활용된다.  이 부총재보는 “지난달 소비자물가 상승률(5%)은 농산물ㆍ석유류 가격이 상당 폭 둔화했다. 이는 지난해 큰 폭 상승한 데 따른 기저효과 등의 영향으로, 지난주 전망 당시 예상에 부합하는 수준”이라고 설명했다.  그러면서 “근원물가는 개인서비스물가의 높은 상승세가 이어지는 가운데 공업제품(석유류 제외)을 중심으로 오름세가 확대됐다”면서 “내년 초까지 5% 수준의 (소비자 물가) 오름세를 이어갈 것으로 예상된다”고 전망했다. 시장에서는 고물가가 지속되면서 한은의 기준금리 조정이 있을 것으로 내다보고 있다. 한은의 다음 통화정책결정 금통위는 내년 1월이다. 내년 1월 금통위에서 0.25%p 상승이 현재 유력하게 전망된다.  한은도 기준금리 정점을 3.5% 안팎으로 전망하고 있다. 이창용 한국은행 총재는 지난달 24일 “이번에 금리가 3.25%로 올라가면서 중립금리의 상단이나 이보다 조금 높은 수준으로 진입한 상태”라며 “최종 금리인상 상단은 대다수 금통위원들이 3.5%로 제안했다”고 설명했다. 이어 30일 로이터통신과 가진 인터뷰에서는 “불확실성이 많지만 상황이 예상대로 흘러간다면 (현재 3.25％인) 금리 인상을 아마도 3.5％ 안팎에서 끝낼 수 있을 것”이라며 “금융통화위원회가 통화 긴축 속도를 재검토하고 집값을 연착륙시키기 위해 노력할 것”이라고 말했다. 조계원 기자 chokw@kukinews.com",쿠키뉴스,https://t1.daumcdn.net/news/202212/02/kukinews/20221202111004801yliq.jpg,https://v.daum.net/v/20221202111003283,1
18,경제,"올해 5%대 물가상승률 전망,24년 만에 최고 수준","[헤럴드경제=이태형·김현경 기자]올해 소비자물가 상승률이 국제통화기금(IMF) 외환위기직후인 1998년이후 24년만에 5%대를 기록할 것으로 전망된다. 올해 소비자물가 상승률은 지난 5월이후 지난달까지 7개월째 5%대 이상을 유지하고 있기 때문이다. 문제는 경기 둔화 국면에서도 물가 상승이 이어지는 ‘스태그플레이션’ 그림자가 더욱 짙어지고 있다는 것이다. 정부는 물가상승을 감안해 내년 국민연금과 기초연금, 공무원연금, 사학연금, 군인연금 등 공적연금 수급자의 내년 연금수령액을 상향 조정키로 했다.이들 공적연금은 해마다 전년도의 물가 변동률을 반영해 연금지급액을 조정해주기 때문이다. 2일 통계청에 따르면 지난달 소비자물가지수는 109.10(2020년=100)으로 작년 같은 달보다 5.0% 올랐다. 지난 4월(4.8%) 이후 가장 낮은 상승률이다. 물가 상승률은 7월에 외환위기 이후 최고치인 6.3%까지 오른 뒤 8월 5.7%, 9월5.6%로 낮아졌으나 10월에는 전기·가스요금 인상에 5.7%로 오름폭을 키웠다. 한 달만에 상승률이 0.7%포인트 낮아진 것이다. 지난 10월을 제외하면 7월을 정점으로 물가 상승세가 점차 둔화하는 양상이다. 다만 5%가 넘는 상승률은 지난 5월(5.4%) 이후 7개월째 이어지고 있다. 따라서 올해 1~11월 평균 물가상승률은 5.08%를 기록, 2008년 금융위기 당시 연간 상승률 4.7%를 넘어서고, 더 나아가 1998년 국제통화기금(IMF) 사태 당시 7.5% 이후 24년 만에 처음 5%대에 올라설 가능성이 커졌다. 또 한국은행은 11월 소비자물가 상승률이 5.0%를 기록하자 예상과 부합하는 수준으로 평가하면서도 내년 초까지 이같은 오름세가 이어질 것으로 전망했다. 이환석 한은 부총재보는 이날 물가 상황 점검회의'를 열고 ""앞으로 소비자물가는 내년 초까지 5% 수준의 오름세를 이어갈것으로 예상된다""면서 ""경기 둔화 폭 확대 가능성 등이 하방 리스크(위험)로, 에너지요금 인상 폭 확대 가능성 등은 상방리스크로 각각 잠재해 있다""고 진단했다. 두바이유 기준 국제유가는 경기침체 우려로 지난달 하순 배럴당 70달대까지 하락했다. 그러나 최근 미 원유 재고 급감, 중국 방역 조치 완화 기대 등으로 80달러대로 반등하는 등 변동성이 확대되고 있다. 이로인해 경제전문가들은 이미 올해부터 경기 둔화 국면에서도 물가 상승이 이어지는 ‘스태그플레이션’ 초읽기에 들어간 우리 경제가 내년 더 어려운 상황을 맞이하게 될 것이라고 경고하고 있다. 최근 국내외 주요 기관 11곳이 예상한 우리나라 내년 경제성장률 전망치(중간값 기준)는 1.9%로 집계됐다. 연간 성장률이 잠재성장을 하회한 것은 코로나19 발생 당시인 2020년(-0.7%)를 제외하면 글로벌 금융위기 당시인 2009년(0.8%) 이후 14년만에 처음이 된다. 문제는 성장률이 1%대로 떨어져도 물가는 여전히 3%대 중반께로 고물가 상황이 이어진단 점이다. 국내외 주요 기관들의 내년 연간 물가성장률 예상치는 3.5%로 전망됐다. 한은의 올해 물가 전망치(5.1%)에 이어 2년 연속 물가목표치(2.0%)를 크게 웃도는 수준이다. 한은은 2024년 연간 물가 수준을 2.5% 정도로 내다보면서 내후년이 되어야 2%대 연간 물가를 볼 수 있을 것이라 보고 있다. 경제협력개발기구(OECD)는 내년 우리나라 물가를 3.9%로 거의 4%에 가깝게 전망해 기관들 중 가장 높은 수준을 내다봤고, IMF 역시 3.8%로 3%대 후반의 물가를 예상했다. 피치의 경우 원자재 가격 둔화, 한은의 통화긴축 지속 등을 이유로 내년 1.5%의 낮은 물가를 예상하기도 했지만 대다수의 다른 기관들은 3%대를 찍어 고물가 상황이 이어질 것이라 봤다. 이런 높은 물가로 저소득층은 여타 계층보다 더 큰 타격을 받고 있다. 통계청이 최근 발표한 3분기 가계동향 조사 분석 결과를 보면, 소득 하위 20%가구의 올해 3분기 실질소득은 103만9600원으로 1년 전 같은 시점보다 6.5% 줄어들었다. 실질소득은 기준년을 2020년으로 고정해서 물가 변동을 제거한 개념이다. 하위 20%의 소득은 명목 기준으로 보면 113만1000원으로 지난해 같은 기간보다 1.0% 감소하는 데 그쳤지만, 물가까지 고려하면 소득 감소 폭이 더 커졌다는 것이다. 정부는 한은의 전망대로 올해 물가가 5%대로 상승하면 공적 연금액에 이런 물가변동률을 반영해 내년 1월부터 일제히 5%대로 인상키로 했다. 국민연금의 경우 1998년 7.5% 올린 게 가장 높은 상승률이었다. 이후 1999년 인상률이 0.8%로 떨어졌다가 2009년 4.7%로 오른 뒤 계속 떨어져 2020년 0.4%. 2021년0.5%로 0%대를 이어갔다. thlee@heraldcorp.com pink@heraldcorp.com",헤럴드경제,https://t1.daumcdn.net/news/202212/02/ned/20221202105739828bfam.jpg,https://v.daum.net/v/20221202103650892,0
18,경제,물가 한풀 꺾였지만 5%대…가계부담 가중(종합)," 어운선 통계청 경제동향통계심의관은 ""원유(原乳) 가격 인상으로 가공식품 출고가 인상이 지속될 것으로 예상되고 석유류 가격도 다소 오름세가 확대될 가능성이 있다""고 말했다. 이어 ""다음 달 이후에는 상하방 요인이 모두 있어 물가 상승률이 지금 수준에서 등락하지 않을까 한다""고 전망했다.  [아시아경제 세종=김혜원 기자, 세종=권해영 기자] 지난달 소비자물가 상승률이 5%를 기록했다. 한 달 만에 0.7%포인트 떨어지면서 상승세가 한풀 꺾였지만 여전히 5%대 고(高)물가다. 가공식품과 외식 물가를 중심으로 내년 초까지도 5% 안팎의 높은 물가가 이어질 것으로 보여 가계 부담은 가중될 전망이다. 2일 통계청이 발표한 '11월 소비자물가 동향'에 따르면 지난달 소비자물가지수는 109.10(2020=100)으로 전년 동기 대비 5.0% 상승했다. 지난 4월(4.8%) 이후 가장 낮은 상승률이다. 소비자물가 상승률은 지난 7월 외환위기 이후 최고치인 6.3%까지 오른 뒤 8월 5.7%, 9월 5.6%로 낮아졌다가 10월 5.7%로 다시 상승 폭을 키웠었다. 전기·가스요금 인상의 영향이 있었던 10월을 제외하면 7월을 정점으로 물가 상승세가 한풀 꺾인 모습이다. 그러나 지난 5월(5.4%) 이후 7개월째 물가 상승률이 5%가 넘는 이례적인 고물가 상황이다. 물가의 기조적 흐름을 보여주는 근원물가(농산물 및 석유류 제외 지수) 상승률은 4.8%로, 글로벌 금융위기 이후 최고치로 뛴 지난달과 동일했다. 2009년 2월(5.2%) 이후 가장 높은 수준이다. 또 다른 근원물가 지표인 식료품 및 에너지 제외 지수는 전년 동월 대비 4.3% 올라 전월(4.2%) 대비 상승 폭이 더 커졌다. 2008년 12월(4.5%) 이후 가장 크게 뛰었다. 근원물가는 계절적 요인, 일시적 충격에 의한 물가 변동분을 제외한 지표로 물가의 장기적 추세를 보여준다. 소비자물가는 7월(6.3%)을 정점으로 상승률이 꺾인 반면 근원물가는 여전히 정점이 확인되지 않고 있는 것이다. 여기에 러시아-우크라이나 전쟁이 장기화하고 국제유가가 다시 상승할 수 있어 물가 안정을 점치기엔 이르다는 게 정부의 견해다. 품목별로는 가공식품, 개인서비스, 전기·가스·수도 요금이 오름세를 이어갔다. 공업제품은 5.9% 올랐는데 이 중 가공식품이 9.4%, 석유류가 5.6% 올랐다. 석유류 상승률은 지난 6월 39.6%를 정점으로 크게 낮아졌지만 가공식품은 6월 7.9%, 7월 8.2%, 10월 9.5%로 점점 상승한 이후 여전히 높은 수준에 머물고 있다. 빵(15.8%), 스낵과자(14.5%) 등이 크게 올랐다. 개인서비스의 경우 외식이 8.6%, 보험서비스료가 14.9% 오르면서 6.2% 상승했다. 외식은 9월 9.0%, 10월 8.9%에 이어 오름세가 둔화하고 있지만 생선회(9.0%) 등을 중심으로 상승세를 이어갔다. 물가 상승률 5.0% 중 먹거리에 해당하는 가공식품과 외식의 기여도는 각각 0.81%포인트, 1.10%포인트였다. 전기·가스·수도는 지난 10월 공공요금 인상으로 전월과 마찬가지로 23.1% 올랐다. 통계 작성을 시작한 2010년 1월 이후 상승 폭이 가장 컸다. 다만 지난달 물가 상승률이 0.7%포인트나 내린 것은 농축수산물 가격 하락의 영향이 컸다. 농축수산물은 전월 대비 0.3% 올라 전월(5.2%)과 비교해 상승률이 크게 낮아졌다. 농산물은 2.0% 하락했고, 축산물과 수산물은 각각 1.1%, 6.8% 상승했다. 농산물 중에서는 오이(-35.3%), 상추(-34.3%), 호박(-34.9%) 등 채소류 하락 폭이 컸다. 물가 상승률은 10월 5.7%에서 11월 5.0%로 크게 둔화했지만, 근원물가가 여전히 높고 기저효과가 작용하면서 물가 하향 안정세를 단정하기엔 이르다는 지적이다. 한국은행도 내년 1분기까지는 5%대의 높은 물가가 지속될 것으로 예상한다. 앞서 이창용 한은 총재는 물가와 관련해 ""11월은 굉장히 예외적인 달이 될 것""이라고 예고했다. 이 총재는 ""지난해 11월에는 채소 가격이 7~8% 올랐고 유가도 굉장히 많이 올라 물가 지표가 10월보다 상당 폭 낮아질 가능성이 있다""며 ""내년 초 기저효과가 사라지면 1~2월에는 다시 5%대 상승률이 지속될 것""이라고 말했다. 러시아-우크라이나 전쟁과 겨울철 유럽 에너지 불안으로 국제유가가 다시 상승할 가능성이 남아 있다는 점도 변수다. 주요국 금리 인상 기조에 따라 안정을 찾고 있는 환율이 다시 뛰면 수입물가도 다시 치솟을 수 있다. 기획재정부 관계자는 ""11월 물가는 배추·무 등 채소류 중심의 농산물 수급 여건 개선 등으로 상승 폭 둔화 흐름이 이어졌지만 연말·연초 제품 가격 조정, 화물연대의 집단운송 거부에 따른 물류 차질 등 대내외 리스크가 여전히 잠재돼 있다""면서 ""물가를 계속해서 예의주시하며 당분간 물가 안정을 최우선으로 대응하겠다""고 전했다. 세종=김혜원 기자 kimhye@asiae.co.kr 세종=권해영 기자 roguehy@asiae.co.kr",아시아경제,https://t1.daumcdn.net/news/202212/02/akn/20221202101829193piox.jpg,https://v.daum.net/v/20221202101829103,0
18,사회,대구·경북 소비자물가 오름세 '주춤'…전달 대비 0.1%↓," ※CBS노컷뉴스는 여러분의 제보로 함께 세상을 바꿉니다. 각종 비리와 부당대우, 사건사고와 미담 등 모든 얘깃거리를 알려주세요.  이메일 :jebo@cbs.co.kr 카카오톡 :@노컷뉴스 사이트 :https://url.kr/b71afn   대구·경북지역의 소비자물가가 전달 대비 하락하는 등 오름세가 주춤하고 있다. 동북지방통계청이 2일 발표한 '2022년 11월 대구·경북지역 소비자물가 동향'을 보면 대구지역의 소비자물가지수는 109.51로 지난해 같은 달 대비 5.2% 상승했다. (전국 5.0% 상승) 또 전달과 비교해서는 0.1% 하락했다. 월간 소비자물가가 내림세를 보인 것은 지난 8월(-0.1%) 이후 4개월 만이다. 대구지역의 지난해 대비 소비자물가 상승률은 지난 7월(6.5%) 최고치를 보인 이후 4개월 연속해 '5%대'를 기록한 것은 물론 지난 4월(4.9%) 이후 7개월 만에 최저치를 기록했다. 소비자가 체감하는 생활물가지수도 지난해 같은 달 대비 5.6% 상승했지만 지난 3월(5.2%) 이후 8개월 만에 다시 '5%대'를 기록했다. 또 전달과 비교해서도 0.3% 하락하면서 지난 8월(-0.5%) 이후  3개월 만에 내림세를 보였다. 11월 경북지역의 소비자물가지수는 110.28로 지난해 같은 달 대비 5.7% 상승했다. 하지만 하락 폭은 전달(6.4%) 보다 0.7%p 축소한 것은 물론 지난 4월(5.8%) 이후 7개월 만에 다시 '5%대'로 내려갔다. 또 전달과 비교해서는 0.1%가 하락했는데 이는 지난 8월(-0.4%) 이후 3개월 만이다. 생활물가지수는 지난해 같은 달 대비 5.8% 상승했고 전달과 비교해서는 0.1% 하락했다. 대구CBS 권기수 기자 meetk@cbs.co.kr ▶ 기자와 카톡 채팅하기▶ 노컷뉴스 영상 구독하기 ",노컷뉴스,https://t1.daumcdn.net/news/202212/02/nocut/20221202104237245vkto.jpg,https://v.daum.net/v/20221202104236154,0
