13,사회,"檢, 6·1지방선거 사범 1448명 기소…부정경선운동 급증","            이는 제7회 전국동시지방선거와 비교해 입건인원은 9.9%(417명) 감소했고, 기소 인원은 20.0%(361명) 감소한 수치다. 기소율은 43.0%에서 38.2%로 4.8%p 떨어졌다.              [이데일리 이배운 기자] 검찰은 지난 6월 실시된 제8회 전국동시지방선거 선거사범에 대한 수사를 진행한 결과, 전체 입건인원 3790명 중 1448명을 기소했다고 2일 밝혔다. 검찰은 입건 인원이 감소한 주요 원인으로 이번 선거가 대통령선거 직후 실시됐기 때문에 본격적인 선거 경쟁이 뒤늦게 시작된 점을 짚었다. 범죄 유형별로는 △흑색선전사범 30.9%(1172명) △금품선거사범 26.4%(999명) △부정경선운동 7.3%(277명) △공무원선거개입 1.7%(66명) 순으로 나타났다.  특히 이번 선거는 이전 선거와 비교해 부정경선운동사범이 급증(85명→277명)한 것으로 나타났다. 검찰은 경선 승리가 당선으로 이어지는 사례가 늘어나 여론조사에 대한 거짓응답유도, 휴대전화 요금청구 주소지 허위이전 등 관련 불법행위도 증가했다고 분석했다.  아울러 당선자 총 입건인원은 322명에서 331명으로 증가한 반면, 당선자 기소인원(139명→134명)과 기소율(43.2%→40.5%)은 모두 감소했다. 기소된 당선자 유형은 광역자치단체장 2명, 기초자치단체장 32명, 광역의원 20명, 기초의원 78명, 교육감 2명 등이다.  검찰은 지난 대선사범 수사에 이어 이번 지방선거사범 수사에서도 검사 수사지휘권 폐지와 맞물려 단기 공소시효의 문제점이 드러났다고 비판했다. 조직적·계획적으로 이뤄지는 선거범죄 특성상 초동수사 단계부터 신속한 강제수사와 법리검토가 필요한데, 공소시효 만료 전 1개월 동안 600명 이상의 선거사범 사건이 검찰에 쏠려 면밀한 검토와 보완수사 진행에 한계가 있단 것이다. 이에 대검 관계자는 “현행 6개월 초단기 공소시효를 전면 폐지하거나, 선거사범 공소시효를 최소 1년에서 2년으로 연장해 필요불가결한 최소한의 수사기간을 보장해야 한다”며 “경찰 수사 개시 후 3개월 내 사건 송치·송부를 의무화하거나 구체적인 수사 상황을 반드시 사전 통보하도록 제도화 해야한다”고 주장했다. 관계자는 이어 “중요한 사건은 원칙적으로 수사검사가 직접 공판에 관여하는 등 불법에 상응하는 형벌이 선고될 수 있도록 공소유지에 충실할 것”이라며 “내년 3월 예정된 제3회 전국동시조합장선거가 공명정대하게 실시 될 수 있도록 철저히 대비하겠다”고 강조했다. 이배운 (edulee@edaily.co.kr) ",이데일리,https://t1.daumcdn.net/news/202212/02/Edaily/20221202092350996ocpo.jpg,https://v.daum.net/v/20221202092348970,0
13,사회,수사권 조정 여파…6·1 지방선거 기소 규모 20% 감소," 입건자 수는 2018년 대비 4207명에서 9.9% 감소했고, 기소인원은 1809명에서 20.0% 줄었다. 기소율 역시 43.0%에서 38.2%로 4.8%P 감소했다. 유형별로는 흑색선전사범 30.9%(1172명), 금품선거사범 26.4%(999명), 부정경선운동 7.3%(277명), 공무원선거개입 1.7%(66명) 순으로 많았다.  [헤럴드경제=좌영길 기자] 지난 6월1일 실시된 제8회 전국동시지방선거 당선자 중 134명이 선거범죄 혐의로 재판에 넘겨졌다. 검·경 수사권 조정과 먼저 치러진 대통령선거 영향 등으로 4년 전 지방선거 때보다 사법처리 규모는 감소했다. 대검 선거수사지원과는 2일 이같은 내용을 담은 제8회 지방선거 선거사범 수사결과를 발표했다. 전체 입건자 수는 3790명이었고, 이 가운데 1448명을 기소했다. 38명은 구속됐다. 기소 규모가 줄었지만, 검찰은 실제 선거범죄가 줄어든 게 아니라고 보고 있다. 올해는 대선이 먼저 치러져 본격적인 선거 경쟁이 뒤늦게 시작된 점이 원인으로 꼽힌다. 아울러 검찰은 지난해 수사권 조정에 따른 검사 수사지휘권 폐지와 맞물려 단기 공소시효의 문제점이 더욱 부각됐다고 보고 개선책을 마련할 방침이다. 선거사범의 경우 공소시효가 6개월로 다른 범죄에 비해 확연히 짧은데, 이를 폐지하거나 연장하는 등 제도개선을 추진하는 한편 검사의 보완수사기간 확보 등 대책도 내놓을 예정이다. 검찰이 직접 수사에 나선 인원은 7회 지방선거 167명에서 올해 89명으로 줄었다. 광역자치단체장으로는 이장우 대전시장(국민의힘)이 확성장치 사용 등 사전선거운동으로 지난달 22일 불구속기소됐고, 오영훈(더불어민주당) 제주지사가 직무상지위 이용 사전선거운동 혐의로 같은달 23일 재판에 넘겨졌다. 교육감 당선자 중에선 하윤수 부산교육감이 허위사실공표 등 혐의, 서거석 전북교육감이 동료교수 폭행 관련 허위사실공표 혐의로 각각 불구속 기소됐다. jyg97@heraldcorp.com",헤럴드경제,https://t1.daumcdn.net/news/202212/02/ned/20221202092315709jzsn.jpg,https://v.daum.net/v/20221202092314959,0
13,사회,檢 '6·1지선 선거법 위반' 1448명 기소,"             [서울경제]             검찰이 올해 6·1 지방선거 선거법 위반 사범 1400여 명을 기소했다. 재판에 넘긴 이들 명단에는 이장우 대전시장(국민의힘)과 오영훈 제주지사(더불어민주당) 등 당선자 134명이 포함된 것으로 파악됐다.   대검은 “수사지휘권 폐지로 경찰 수사 단계에서는 검사가 사건에 관여할 수 없었다”며 “공소시효 만료 전 1개월 동안 600명 이상의 선거 사범 사건이 검찰에 집중 송치·송부돼 면밀한 검토와 보완 수사 진행에 한계가 있다”고 했다. 천민아 기자 mina@sedaily.com            대검찰청은 선거법 위반 사범 1448명(37명은 구속 기소)을 재판에 넘겼다고 2일 밝혔다. 이 중 당선자는 △광역자치단체장 2명 △기초자치단체장 32명 △광역의원 20명 △기초의원 78명 △교육감 2명으로 총 134명이 기소됐다. 광역자치단체장 중 이 시장은 확성 장치를 사용한 사전 선거운동 혐의, 오 지사는 직무상 지위를 이용한 사전 선거운동 혐의를 받는다. 교육감 당선자 가운데는 선거 사무소로 활용된 유사 기관을 불법 설치하고 허위 사실을 공표한 혐의를 받는 하윤수 부산교육감과 동료 교수 폭행 사실과 관련한 허위 사실을 언급한 서거석 전북교육감이 불구속 기소됐다. 검찰은 6·1 지방선거와 함께 치러진 국회의원 재·보궐선거와 관련해서도 선거 사범 수사를 마쳤다. 당초 이재명 민주당 대표와 안철수 국민의힘 의원 등이 입건됐으나 최종 기소 대상에서는 빠졌다. 올해 지방선거 관련 선거법 위반 입건자는 모두 3790명으로 2018년 제7회 지방선거 입건자 4207명에 비해 9.9% 감소했다. 기소 인원은 2018년 1809명에서 올해 1448명으로 20.0% 줄었다.",서울경제,https://t1.daumcdn.net/news/202212/02/seouleconomy/20221202174502694lgmq.jpg,https://v.daum.net/v/20221202174458972,0
13,사회,대전 이장우·제주 오영훈 등 지방선거 당선자 134명 기소," [더팩트ㅣ장우성 기자] 이장우 대전시장, 오영훈 제주도지사 등 6월 지방선거 당선자 134명이 재판에 넘겨졌다.            검찰 수사 결과 3790명 입건·1448명 기소·38명 구속 대검찰청은 지방선거 선거사범 수사 결과 공소시효 만료일인 전날까지 3790명을 입건해 1448명을 기소했다고 2일 밝혔다. 기소된 당선자는 이장우 대전시장·오영훈 제주도지사 등 광역단체장 2명, 하윤수 부산교육감·서거석 전북교육감 등 교육감 2명을 포함해 134명이다. 기초자치단체장 32명, 광역의원 20명, 기초의원 78명이 포함됐다. 기초단체장 기소자를 정당별로 보면 더불어민주당 10명, 국민의힘 19명, 무소속 3명이다.  선거사범 입건 인원은 2018년 7회 지방선거 4207명에서 3790명으로 9.9% 감소했다. 기소 인원은 1809명에서 1448명으로 20.0% 감소했다. 기소율은 43.0→38.2%, 구속인원은 56→38명으로 줄었다.  입건 유형별로 보면 흑색선전사범이 1172명(30.9%)으로 가장 많았다. 금품선거사범 999명(26.4%), 부정경선운동 277명(7.3%), 공무원선거개입 66명(1.7%)의 순이다. 4년 전과 비교해 부정경선운동사범이 85명에서 277명으로 크게 늘었다. 수사권 조정에 따른 검찰 직접수사 제한 등으로 검찰이 직접 수사를 개시한 인원은 167명에서 89명으로 줄었다.  대검 측은 이번 지방선거 수사 결과 선거사범 단기 공소시효 문제점이 거듭 드러났다고 지적했다. 현행 6개월 초단기 공소시효를 전면 폐지하거나 1~2년으로 연장해 수사기간을 보장해야 한다는 입장이다. 경찰 수사 개시 3개월 내에 사건을 송치 의무화하거나 구체적인 수사상황을 반드시 통보하도록 해 검사의 보완수사기간을 확보해야한다고도 제안했다. 대검 관계자는 ""중요사건은 원칙적으로 수사검사가 직접 공판에 관여하는 등 불법에 상응하는 형벌이 선고되도록 충실히 공소를 유지하겠다""고 밝혔다.  leslie@tf.co.kr 발로 뛰는 더팩트는 24시간 여러분의 제보를 기다립니다.▶카카오톡: '더팩트제보' 검색▶이메일: jebo@tf.co.kr▶뉴스 홈페이지: http://talk.tf.co.kr/bbs/report/write",더팩트,https://t1.daumcdn.net/news/202212/02/THEFACT/20221202100826650uqop.jpg,https://v.daum.net/v/20221202100823660,0
13,사회,"6·1 지방선거 ‘당선자’ 중 134명 재판 行… 檢, 1449명 기소"," [아시아경제 허경준 기자] 검찰이 6·1 지방선거와 관련해 선거사범 1400여명을 재판에 넘겼다. 이장우 대전광역시장과 오영훈 제주지사가 사전선거운동을 한 혐의로 재판에 넘겨졌다.  대검찰청 공공수사부는 2일 공소시효 만료일인 전날까지 전체 입건 인원 3790명 가운데 1449명을 기소했다고 밝혔다. 4년 전 실시된 제7회 지방선거 대비 입건 인원은 9.9%, 기소 인원은 20% 감소한 수치다. 검찰은 6·1 지방선거 당선자 중 광역자치단체장 2명, 기초자치단체장 32명, 광역의원 20명, 기초의원 78명, 교육감 2명(하윤수 부산교육감, 서거석 전북교육감) 등 총 134명을 재판에 넘겼다. 기소된 기초자치단체장의 정당은 국민의힘 19명, 더불어민주당 10명, 무소속 3명이다. 앞선 지방선거에 비해 입건 인원은 소폭 증가했으나, 기소 인원과 기소율은 모두 감소한 것으로 나타났다. 이에 대해 이원석 검찰총장은 이날 출근길에 기자들과 만나 ""여당에 대한 기소가 야당보다 2배가량 많은 것으로 알고 있다""며 ""당적이나 진영, 지위, 이념과 관계없이 증거와 법리에 따라서만 수사를 하고 있다""고 말했다. 유형별로는 전체 입건 인원 중 흑색선전이 30.9%로 가장 높은 비율을 차지했고, 금품선거가 26.4%로 뒤를 이었다. 부정경선운동이 7.3%, 공무원 선거개입이 1.7% 순으로 확인됐다. 앞선 선거보다 부정경선운동사범이 85명에서 227명으로 급증했다. 검찰은 경선 승리가 당선으로 이어지는 사례가 늘어나 여론조사에 대한 거짓응답 유도, 휴대전화 요금 청구 주소지 허위이전 등 각종 불법행위가 증가했다고 보고 있다. 고소·고발에 의한 입건이 2695명으로 가장 많았고, 경찰 수사를 통한 입건이 1006명, 검찰 수사를 통한 입건이 89명으로 나타났다. 수사권 조정 이후 첫 지방선거여서 검사의 직접 수사가 제한된 탓에 검찰의 직접수사개시 인원이 감소했다. 검찰은 지난 대선사범 수사에 이어 이번 지방선거사범 수사에서도 지난해 검사의 수사지휘권 폐지와 맞물려 단기 공소시효의 문제가 드러났다고 판단했다. 단기 공소시효가 적용되고 조직·계획적으로 이뤄지는 선거 범행의 특성을 고려할 때 초동수사 단계부터 신속한 강제수사와 치밀한 법리검토를 통한 혐의 특정이 필요한데, 수사지휘권 폐지로 경찰 수사단계에서는 검사가 사건에 관여할 수 없고 공소시효 만료 전 한 달 동안 600명 이상의 선거사범 사건이 검찰에 집중 송치·송부돼 면밀한 검토와 보완수사 진행에 한계가 있다는 것이다. 검찰 관계자는 ""현행 6개월 초단기 공소시효를 전면 폐지하거나, 선거사범 공소시효를 최소 1년 내지 2년으로 연장해 최소한의 수사 기간 보장이 필요하다""며 ""검·경이 공소시효 만료일 3개월 전까지 수사할 사항, 법령적용 등에 대한 의견 제시와 교환 의무화를 추진해야 한다""고 말했다. 허경준 기자 kjune@asiae.co.kr",아시아경제,https://t1.daumcdn.net/news/202212/02/akn/20221202141713124iiay.jpg,https://v.daum.net/v/20221202092928173,0
13,사회,"검찰, '6·1 지방선거' 선거법 위반 혐의 1448명 기소…당선자도 134명","검찰이 지난 6·1 지방선거 당시 공직선거법을 위반한 혐의를 받는 1,448명을 재판에 넘겼습니다.대검찰청은 6·1 지방선거 관련 범죄로 3,790명을 입건하고 그중 1,448명을 기소했다고 밝혔습니다.또 이 가운데 선거에서 당선된 사람은 134명이라고 밝혔습니다.유형별로 살펴보면 흑색선전사범이 1,172명(30.9%)으로 가장 많았고, 그 뒤로 금품선거사범 999명(26.4%), 부정 경선운동 277명(7.3%), 공무원 선거개입 66명(1.7%)이 뒤를 이었습니다.또, 투표지를 촬영하거나 벽보·현수막 훼손 등 기타 혐의로 입건된 이들은 1276명(33.7%)이었습니다.지방선거 후 입건자 수는 제6회 지방선거(4,450명)부터 감소하는 추세인데, 지난 제7회 지방선거(4,207명) 대비로는 9.9% 줄었습니다.이번 지방선거는 대통령 선거 직후 시행되면서 선거 경쟁이 늦게 불붙어 입건 인원도 감소한 것으로 추정됩니다.검찰이 이번 지방선거 관련 공직선거법 위반 혐의로 기소한 이들 가운데 당선자는 134명으로, 이장우 대전시장과 오영훈 제주지사가 포함됐습니다.또 하윤수 부산교육감과 서거석 전북교육감, 기초자치단체장 32명도 재판에 넘겨졌습니다.대검은 선거사범 수사시스템 개선이 필요하다고 지적했습니다. 6개월이라는 단기 공소시효가 적용되는 상황에서 조직적·계획적으로 이루어지는 선거범행의 전말을 밝히려면 초동수사 단계에서 신속한 강제수사와 치밀한 법리 검토가 필요하다는 건데, 이를 위해 단기 공소시효 제도를 개선하고 초동수사 단계부터 검찰과 경찰의 협력절차가 실질화되어야 한다고 언급했습니다.또, 공소시효 6개월 중 검사의 보완수사기간이 확보될 수 있도록 경찰 수사 개시 후 3개월 내에 사건을 송치하는 걸 의무화하도록 제도를 개선할 필요가 있다고 덧붙였습니다.대검 관계자는 ""불법에 상응하는 형벌이 선고될 수 있도록 충실히 공소를 유지하겠다""고 밝혔습니다.[길기범 기자 road@mbn.co.kr]< Copyright ⓒ MBN(www.mbn.co.kr)무단전재 및 재배포 금지 > ",MBN,https://t1.daumcdn.net/news/202212/02/mbn/20221202100245542ptwo.jpg,https://v.daum.net/v/20221202100244451,0
15,스포츠,"[카타르 WC] 기시다 日 총리도 반색, “명승부 펼친 대표팀에 경의를”","[STN스포츠] 이형주 기자 = 일본 기시다 후미오(65) 총리도 반색했다.  일본은 2일(한국시간) 카타르 도하에 위치한 칼리파 인터내셔널 스타디움에서 열린 2022 국제축구연맹(FIFA) 카타르 월드컵 조별리그 E조 3차전 스페인과의 경기에서 2-1로 승리했다. 일본은 이 경기 결과를 통해 조1위로 16강에 올랐다. 일본이 1차전 독일에 이어 3차전 스페인까지 잡는 파란을 일으켰다. 이를 통해 월드컵 7승 째를 신고한 일본은 한국을 넘어 아시아 월드컵 최다승 팀이 됐다. 명실상부 아시아 최강의 면모를 보여주고 있다.  일본의 실질 통수권자라고 할 수 있는 기시다 후미오 총리도 2일 대표팀의 선전에 기뻐했다. 기시다 총리는 같은 날 자신의 SNS에 ""스페인에 승리! 월드컵 조별리그 1위 돌파! 대표팀 축하합니다. 선수 분들께서는 큰 압박이 있는 상황에서 명승부로 훌륭한 결과를 낳았습니다. 대표팀의 분투에 경의를 표하며 이 기쁨을 일본 국민들과 나누고 싶습니다""라고 전했다.  기시다 총리는 해당 글과 함께 모리야스 하지메 일본 대표팀 감독과 전화 통화를 하는 영상을 찍어 업로드하기도 했다. 기시다 총리는 ""모리야스 감독은 물론 타지마 유키조 일본축구협회 회장과도 직접 전화했습니다. 일본 국민 분들께 (응원을 통해) 용기를 받았다고 말해왔습니다. 다시 한 번 조별리그 통과 축하합니다. 토너먼트도 기대하겠습니다. 힘내라 일본!""이라고 덧붙였다.  STN스포츠=이형주 기자 total87910@stnsports.co.kr ▶STN SPORTS 모바일 뉴스 구독 ▶STN SPORTS 공식 카카오톡 구독 ▶STN SPORTS 공식 네이버 구독 ▶STN SPORTS 공식 유튜브 구독",에스티엔,https://t1.daumcdn.net/news/202212/02/STNSPORTS/20221202181435333rjvh.png,https://v.daum.net/v/20221202181432661,1
15,스포츠,"[카타르 WC] ‘아시아 최강’ 일본 모리야스 감독, “국민께 감사! 8강 도전!”","[STN스포츠] 이형주 기자 = 모리야스 하지메 감독이 취재진 앞에 섰다.  일본은 2일(한국시간) 카타르 도하에 위치한 칼리파 인터내셔널 스타디움에서 열린 2022 국제축구연맹(FIFA) 카타르 월드컵 조별리그 E조 3차전 스페인과의 경기에서 2-1로 승리했다.  일본이 저력을 보여줬다. 독일, 스페인, 코스타 리카와 한 조에 속했을 때만 하더라도 일본의 광속 탈락을 예상한 이들이 대부분이었다. 하지만 독일을 침몰시키더니, 스페인까지 무너뜨리며 조 1위로 16강에 올랐다.  일본은 이날 16강행으로 최초의 기록도 쓰게 됐다. 32강 체제 이후 아시아 국가로서는 최초로 두 대회 연속 16강에 올랐다.  더불어 일본은 월드컵 7승째를 기록하게 됐다. 이를 통해 통산 6승의 한국을 누르고 아시아 최다승 팀으로 자리하게 됐다. 같은 날 일본 언론 <닛칸 스포츠>에 따르면 모리야스 감독은 ""전반은 괴로움의 연속이었지만, 선수들이 끈질기게 팀으로 목표를 향해 달려갔습니다. 할 수 있다고 믿고 계속 나아갔습니다. 팬들의 응원도 컸습니다""라며 운을 뗐다.  이어 ""일본 국민 여러분! 응원해주셔서 감사드립니다. 덕분에 어려웠던 경기를 함께 기뻐할 수 있는 결과를 만들었습니다. 이제 (그간 최고 기록이었던) 16강을 넘어 8강 이상에 도전해보겠습니다""라고 덧붙였다.    STN스포츠=이형주 기자 total87910@stnsports.co.kr ▶STN SPORTS 모바일 뉴스 구독 ▶STN SPORTS 공식 카카오톡 구독 ▶STN SPORTS 공식 네이버 구독 ▶STN SPORTS 공식 유튜브 구독",에스티엔,https://t1.daumcdn.net/news/202212/02/STNSPORTS/20221202063225188mgjw.png,https://v.daum.net/v/20221202063223598,1
15,스포츠,"일본, 스페인에 2-1 역전승…아시아 첫 2회 연속 16강 진출 [카타르 월드컵]","일본이 스페인에 역전승을 거두며 '조 1위'로 2022 카타르 월드컵 16강에 진출했다. 일본은 2일(한국시간) 카타르 알라이얀의 칼리파 인터내셔널 스타디움에서 열린 카타르 월드컵 조별리그 E조 최종 3차전에서 2대 1로 이겼다. 일본은 전반 스페인의 알바로 모라타에게 선제골을 허용했으나 후반 연속 득점에 성공했다.  칼리파 스타디움에서 치른 1차전에서 독일을 2대 1로 이기며 주목받은 조 1위 후보이던 스페인까지 격파했다. 이에 일본은 승점 6을 쌓아 경기 전까지 1위던 스페인(승점 4)을 제치고 조 1위로 16강에 안착했다. 일본은 이에 따라 7회 연속 월드컵 본선에 오르고, 통산 4번째 16강에 진출했다. 2회 연속 월드컵 16강 진출은 아시아 국가 중 처음이다. 아시아 팀이 월드컵에서 1위로 조별리그를 통과한 것 역시 2002년 한·일 월드컵 당시 한국에 이어 이번이 두 번째다. 오정민 한경닷컴 기자 blooming@hankyung.com ▶ 해외투자 '한경 글로벌마켓'과 함께하세요▶ 한국경제신문과 WSJ, 모바일한경으로 보세요",한국경제,https://t1.daumcdn.net/news/202212/02/ked/20221202072004537plfn.jpg,https://v.daum.net/v/20221202072002354,1
15,스포츠,"'日 레전드' 혼다도 엄지척 ""모리야스의 5백 적중, 모든 수가 맞아들었다""[월드컵 말말말]"," [스포츠한국 허행운 기자] 일본이 자국 역사상 첫 2대회 연속 16강 진출은 물론 아시아에서도 최초 기록을 써내는 값진 승리를 따냈다. 말 그대로 축제의 장이 된 일본이다.           모리야스 하지메 감독이 이끄는 일본은 2일(이하 한국시간) 오전 4시 카타르 알라이얀의 칼리파 인터내셔널 스타디움에서 열린 2022 국제축구연맹(FIFA) 카타르 월드컵 조별리그 E조 최종전 스페인과의 경기에서 2-1 승리를 거뒀다.   전반 11분 알바로 모라타의 헤더로 실점하고 출발했던 일본이다. 하지만 지난 독일전을 연상시키듯, 후반전에 대반전 드라마를 썼다. 후반 3분 도안 리츠가 동점골을 쏘아 올렸고 이어진 후반 6분 미토마 카오루의 포기하지 않는 집념이 다나카 아오의 역전골로 이어졌다. 순식간에 2-1로 경기를 뒤집은 일본은 이 점수를 지키며 기분 좋은 승리를 완성시켰다.   이로써 일본은 2승 1패, 승점 6점을 찍으면서 무려 스페인과 독일을 제치고 조 1위에 등극해 16강에 진출하는 기염을 토했다. 지난 2018 러시아 월드컵에 이어 2연속 16강 진출로 아시아 최초 기록을 쓴 일본은 자국 역사상 4번째 토너먼트 진출이라는 위업을 달성했다.   특히 아시아 팀이 조별리그를 1위로 통과한 것도 드문 기록이다. 지난 2002 한·일 대회 때 한국과 일본 각각 조 1위를 달성한 이후, 20년 만에 나온 세 번째 아시아 국가의 1위 기록이다. 분위기가 최고조에 오른 일본은 이제 사상 첫 8강 진출에 도전한다.   일본 열도 전체가 광란의 도가니에 빠졌다. 이날 경기를 일본 스트리밍 플랫폼 아베마TV를 통해 해설한 일본 축구의 레전드 혼다 게이스케도 기쁨을 숨기지 못했다.   일본 매체 닛칸스포츠에 따르면 혼다는 조 1위 마무리에 대해 ""이보다 더 좋은 결과는 없다""며 만족감을 드러냈다. 이어 모리야스 감독의 지휘에도 호평을 쏟아놨다. 그는 ""이날 일본은 5백으로 경기에 나섰고, 그것이 적중했다. 경기의 전반적인 지휘도 모두 맞아들었다. 대단했다""고 말했다.           혼다의 해설과 함께 지켜본 경기를 지켜본 일본 팬들도 감독의 리더십에 대해 ""모리야스 감독은 일본인 감독답게 선수 중심으로 그들에게 동기부여하는 데 주력하는 감독이다. 외국인 감독이 축구에 대한 자신의 이상향, 철학에 선수를 맞추는 경향이 있는 것과는 다르다""며 사령탑의 성과를 치켜세우는 데 동참했다.   또다른 팬들은 ""아시아 예선에서 탈락 위기에도 처했지만, 현재 결과가 나오고 있으니 모리야스 감독이 정답인 것은 틀림 없다. 명장과 평범한 감독 중 어떤 것이 진짜 모리야스 감독의 얼굴인지 모르겠지만 승부에 강한 사람인 것은 확실하다""며 그를 인정하는 모습도 보였다.   자국 4번째 16강으로 향하는 일본은 이제 크로아티아를 만난다. 앞선 2002년에는 튀르키예(0-1)에, 2010년은 파라과이(승부차기 3-5)에, 2018년은 벨기에(2-3)에 무릎 꿇었던 일본은 사상 첫 8강에 도전한다.   혼다는 ""일본이 축구 강국이 되기 위해서는 아직 해야만 하는 것이 많이 남아있다. 그 첫 발걸음이 다가올 크로아티아전에서 드러날 것이라 생각한다""며 2연속 16강 진출에서 그치지 않고 8강이라는 새 역사를 쓰길 바라는 마음을 전했다.   스포츠한국 허행운 기자 lucky@sportshankook.co.kr ",스포츠한국,https://t1.daumcdn.net/news/202212/02/SpoHankook/20221202112724584kszz.jpg,https://v.daum.net/v/20221202112721963,1
