정치,"[더뉴스] 국조법 제정 이후 국정조사 2차례, 어떻게 진행됐나?","이태원 참사의 진상을 규명하기 위한 국정조사를 두고 여야가 맞붙었습니다.  여당은 국정조사로 수사를 먼저 진행하고 이후 결과를 보고 국정조사 실시 여부를 결정하자는 입장이지만, 야당은 수사는 수사대로 국정조사를 추가로 진행해야 한다고 주장합니다.  오늘 국정조사요구서까지 제출할 계획입니다.  국정조사를 진행하면 국회 차원에서 중요한 현안에 대해 진상규명과 조사를 할 수 있습니다.  국회가 조사한 결과를 해당 기관으로 보내 시정 조치를 요구할 수 있고 기관은 이를 국회에 다시 보고해야 합니다.  범죄 혐의를 살피는 검찰, 경찰 수사와는 별도로 국회의 영역에서 진상 규명을 하는 겁니다.  국정감사 및 조사에 관한 법률이 마련된 1988년 이후 이태원 참사 이전까지 국내에서 10명 이상의 사망자가 발생한 대형 사고는 모두 19건에 달합니다.  이 가운데 사망자가 100명이 넘는 사고는 이렇게 4건이었는데요.  국정조사가 진행된 사례는 '삼풍백화점 붕괴 사고'와 '세월호 침몰 사고' 2번이었습니다.  그동안 대형참사가 일어난 경우 국정조사는 검찰 수사가 마무리되기 전 시작해 수사와 국정조사가 동시에 진행되는 경우가 대다수였습니다.  1995년 6월, 삼풍백화점 붕괴로 502명이 목숨을 잃었을 때도 여야 합의로 국정조사 특별위원회가 구성됐고, 위원회는 한 달가량 활동했습니다.  이 기간 특위는 6번의 회의와 8번의 조사를 진행했습니다.  이후 여야는 보고서를 채택한 뒤 재난방지 관련 법을 제·개정했습니다.  검찰도 사고 발생 당일 검·경 합동수사본부를 구성해 고 이준 삼풍백화점 회장 등 관련 인물 25명을 기소했습니다.  2014년 4월, 꽃다운 299명이 목숨을 잃은 세월호 사고.  세월호 참사 국정조사는 검·경 합동수사본부가 수사 중이던 2014년 5월 국회 본회의에서 승인됐습니다.  하지만 여야가 공방을 벌이며 파행을 거듭하다 청문회를 한 번도 열지 못했습니다.  정부의 초동 대응에 문제가 있었다는 사실을 밝혀냈지만, 청와대 책임에 대한 규명이 부족했다는 평가를 받으며 90일 동안의 활동을 마쳤습니다.  잇따른 대형 참사로 안타깝게 목숨을 또 잃는 일이 반복돼서는 안 되겠죠.  정치권이 진상규명과 후속대책 마련을 위한 국정조사 실시 여부를 정치적인 시각으로만 바라보고 정쟁을 벌일 것이 아니라,  고인이 된 희생자들을 위한 올바른 길이 무엇인지, 정치라는 단어에 담긴 그 무거운 책임감을 다시 한 번 고민해봐야 할 때입니다.  YTN 엄지민 (thumb@ytn.co.kr) ※ '당신의 제보가 뉴스가 됩니다'  [카카오톡] YTN 검색해 채널 추가  [전화] 02-398-8585  [메일] social@ytn.co.kr",https://v.daum.net/v/20221109141616198
사회,"아파트단지서 마른 하늘에 20㎏ '감벼락'…""무서워서 어찌 살아요""","(광주=뉴스1) 이수민 기자 = '쿵!' 지난달 26일 오전 11시59분, 광주 서구 금호동의 한 아파트.  아파트 건물에서 갑자기 떨어진 20㎏ 감박스가 단지 내에 주차된 고급 세단을 덮쳤다. 박스가 떨어진 제네시스 G80 차량의 앞유리 보닛과 휀다가 찌그러졌다. 터진 감의 파편이 주변으로 튀었다. 다행히 행인은 없었다. 잠시 뒤 소리를 듣고 밖으로 나온 주민들이 황급히 관리사무실에 모였다.  ""이게 무슨 마른 하늘에 감벼락이야! 밖에 봤어요?"" 7일 오후 해당 아파트에서 만난 주민들은 여전히 관리사무소에 모여 열흘 전 사건의 폐쇄회로(CC)TV 영상을 시청하고 있었다. 주민 A씨(50대·여)는 ""사람이 맞았으면 즉사했을 것""이라며 ""입주민들 사이에선 이번 사건을 모르는 사람이 없다. '감박스 묻지마 테러'라면서 그 쪽으로 다니길 무서워 한다""고 말했다. 이어 ""그 동에 사는 아줌마들은 벌벌 떤다""며 ""어떻게든 지나가야 하는 자리니까 빨리 범인을 잡아줘야 한다. 안 그러면 집 사람들 다 이사가게 생겼다""고 하소연했다. 사고가 난 지점은 한 동의 출입구 앞. 평소 쓰레기 수거 차량이 정차하는 지점으로 아파트 주차량이 많아 지하주차장이 혼잡스러운 날에는 주민들이 종종 차를 세우는 지점이다. 이곳 역시도 '주차라인'이 그려져 있어 명백히 주차구역이다. 바로 앞에는 동 출입구 앞이자 정문에서 단지 안으로 통하는 지름길 '쪽길'이 껴있다. 해당 동에 거주하지 않는 주민들도 나이가 많은 어른부터 어린이까지 자주 통행한다. CCTV에 떨어지는 장면이 그대로 찍혀 금방 범인을 잡을 수 있을 줄 알았지만 카메라가 아파트를 정면으로 비추는 것이 아닌 옥상에 있는 것이라 어느 층에서 떨어졌는지는 보이지 않는다. 다만 떨어진 감박스가 택배로 온 박스라는 점을 토대로 몇 층 소유였는지 추측은 할 수 있다. 하지만 복도식 아파트 특성상 다른 집의 택배상자를 훔쳐 던졌을 가능성도 배제할 수 없는 상황이다.  아파트 주민들은 이런 '묻지마 던지기 테러'가 처음이 아니라고 말했다. 주민 B씨(27)는 ""이전에 같은 지점에서 자전거도 떨어지고 화분도 떨어진 적이 있다""고 주장했다.  관리사무소 역시 상황의 심각성을 인지해 ""사생활 보호가 가능하게끔 멀리서라도 아파트 건물이 비추는 방향으로 CCTV 설치를 해야할 지 고려 중이다""고 말했다. 가장 곤란한 상황을 맞이한 건 차주 C씨(28)다. 사고가 난지 한참이 지났지만 차량은 여전히 제자리에 있다. 감의 파편들이 말라 비틀어져서 차량 곳곳에 묻어있다. 그는 ""자차보험을 들어놓지 않았기에 전부 자부담을 해야하는 상황이다. 수리비가 300만원 정도 나온다는데 잘못도 없이 생돈 300만원을 지출할 수 없는 일 아니냐""고 털어놨다. 이어 ""불법주차를 한 것도 아니고, 누구에게 원한 산 적도 없는데 왜 이런 일을 겪어야 하냐""며 ""며칠째 차를 그대로 두느라 일하는 것도 너무 불편하다. 빨리 범인을 잡아주길 바란다""고 말했다. C씨를 비롯한 아파트 주민들은 현재 이 사건을 경찰에 신고한 상황이다.  경찰은 아파트 옥상에서 촬영됐다는 CCTV 영상과 차량으로 떨어진 감박스를 확보해 범인을 찾고있다. breath@news1.kr ",https://v.daum.net/v/20221109142424599
사회,"""3년째 배달 음식에 사치만 하는 아내""…이혼 시 위자료 가능할까","            박효주 기자 app@mt.co.kr            결혼 직후 다니던 직장을 그만두고 3년째 놀면서 배달 음식에 사치만 하는 아내와 이혼을 생각하고 있다는 한 남성 사연이 전해졌다. 9일 YTN라디오 '양소영 변호사의 상담소'에서는 결혼 3년 차인 남성 A씨가 배우자의 불성실을 이유로 이혼 시 위자료를 받을 수 있는지 물어왔다. 사연에 따르면 학원 강사였던 A씨의 아내는 결혼 직후 일을 그만뒀다. 전업주부가 됐지만 가정 살림에는 충실하지 않았다. 배달 음식을 시키기 일쑤였고 온라인 쇼핑에 자신을 가꾸는 데만 관심을 뒀다. 심지어는 한 달에 며칠씩 처제까지 불러 함께 배달 음식 시켜 먹고 TV를 보며 놀았고 그렇게 3년이 지났다고 한다. A씨는 ""결혼 생활 동안 밥 한 끼 차려준 적 없다. 오히려 매일 퇴근 후 아내가 배달시켜 먹고 남은 음식을 치웠다""며 ""청소도 주말에 내가 하고 있다""고 토로했다.  이어 ""이런 상황에서 아내는 '내 용돈을 줄이고 생활비를 더 달라'고 요구했고 분노가 폭발했다""며 ""결국 다퉜고 아내가 집을 나갔다""고 했다. 너무 화가 난 A씨는 집 잠금장치 비밀번호를 바꾸고 다음 날 아내 짐을 모조리 처가로 보냈다고 한다. 또 아내가 찾아와도 문을 열어주지 않았고 이후 모든 연락까지 차단했다. A씨는 ""현재 사는 집은 총각 때부터 살던 집인데 다른 번호로 연락해 온 처제가 이 집은 부부 공동생활 공간이라면서 고소하겠다고 적반하장으로 나온다""며 ""그동안 남편 취급 한번 받지 못했는데 이혼할 때 위자료 가능하냐""고 물었다.  답변에 나선 강효원 변호사는 ""소송을 생각하면 법에 있는 이혼 사유를 주장해야 한다""며 ""사연을 보면 민법 840조의 2호의 배우자가 악의로 다른 일방을 유기한 때나 아니면 3호에 배우자로부터 심히 부당한 대우를 받은 때로 주장해 볼 수 있을 거 같다""고 했다. 다만 ""이혼 소송을 하게 되면 주장에 대한 증거가 있어야 한다""며 ""결혼 3년 동안 밥을 한 번도 차린 적 없고 집안일을 아무것도 안 했다는 부분을 어떻게 입증할지가 어려운 문제""라고 덧붙였다. 위자료에 대해서는 ""남편분이 정말 많이 참은 것 같지만 시원하게 답하기 어렵다""며 ""위자료를 인정을 받으려면 앞서 언급한 것처럼 명백한 어떤 증거가 있어야 한다""고 답했다. 이에 양 변호사가 ""처음으로 답변하는 변호사님에게 반대 의견을 내고 싶다""며 ""배달음식 시켜 먹고 쇼핑하고 자기 관리 등 남편이 준 생활비를 어떻게 썼는지 살펴보면 충분히 위자료 받을 수 있을 것 같다""고 했다.  그러자 강 변호사는 ""남편분 입장에서 그렇지만 소송을 하다 보면 아내 입장에서도 불만이 있기 마련이라 양측 이야기를 들어봐야 한다""고 답했다. 재산 분할에 대해 강 변호사는 ""집을 A씨가 총각 때부터 갖고 있었다고 해도 혼인해서 공동생활을 시작하게 된 이상 그 집도 재산분할 대상이 된다""면서도 ""혼인 기간 외벌이를 했기 때문에 기여도가 아내보다 더 많이 인정될 거 같다. 또 A씨 말대로 아내가 불성실한 결혼 생활을 했다면 남편 쪽으로 참작되는 요소가 될 수 있다""고 설명했다.",https://v.daum.net/v/20221109142415591
사회,[속보]일산대교 '사업자 취소·통행료 징수금지' 경기도 패소," ※CBS노컷뉴스는 여러분의 제보로 함께 세상을 바꿉니다. 각종 비리와 부당대우, 사건사고와 미담 등 모든 얘깃거리를 알려주세요.  이메일 :jebo@cbs.co.kr 카카오톡 :@노컷뉴스 사이트 :https://url.kr/b71afn   일산대교 '사업자 취소·통행료 징수금지' 경기도 패소 CBS노컷뉴스 정성욱 기자 wk@cbs.co.kr",https://v.daum.net/v/20221109142406585
정치,"뿔난 전여옥 ""文, 풍산개 달력팔이 시키고 개버린…참 비정해""","전여옥 전 국회의원이 문재인 전 대통령의 '풍산개 논란'과 관련해 ""풍산개 달력팔이 시키고 개버린""이라고 강하게 비판했다. 전여옥 전 의원은 8일 SNS에 ""반려견과 함께하는 제 친구는 '차라리 잘 됐다'더라. 풍산개와 교감은커녕 제대로 먹이지도 않았을 거라며 마음 아파했다""라고 썼다. 그는 ""사룟값도 아까워했는데 '커피믹스'만 먹인 것 아니냐고 시사만평도 꼬집었다. 돈 안 주니 못 키운다? 세금 없이 월 1400만원, 비서 4명, 경호원 65명, 이 정도 클래스면 충분히 키울 수 있다""라고 말했다. 이어 ""별도 개 관리사가 필요한 지도 의문이다. 그런데 파양하고 쫓아내기 직전까지 '도구'로 알뜰히 써먹었더라""라며 ""풍산개 껴안고 빵빵 찍은 문재인 달력! 벽걸이달력은 1만4220원, 탁상 달력은 8820원이란다. 문빠들(문재인 전 대통령 지지자들), 열혈 홍보 중이더라""라고 했다. 또 ""그 수익은 김정숙 여사한테 간단다. 풍산개 모델료만 해도 밥값은 충분히 하는 건데, 달력팔이하면 풍산개 두 마리 충분히 먹인다""라며 ""참 비정하고 냉혹한 사람들이다. 결코 잊지 못할 저 싸늘한 눈빛 어디 가겠나""라고 비판했다. 문 전 대통령 측은 김정은 북한 국무위원장에게서 선물 받은 풍산개 '곰이'와 '송강'을 파양 선언 하루 만인 8일 정부에 인도했다. 문 전 대통령 측과 행정안전부 대통령기록관에 따르면 양측은 이날 오후 대구 경북대병원 동물병원에서 만나 곰이와 송강을 인수인계했다. 국가 원수 자격으로 받은 풍산개는 대통령기록물이다. 기록물 관리 권한이 이동하면 기록물 상태를 점검하듯 곰이와 송강도 건강 상태를 점검하고자 병원에 입원시켰다는 게 대통령기록관의 설명이다. 대통령기록관은 ""풍산개를 맡아 관리할 기관, 관리 방식 등을 검토·협의 중""이라면서 ""관리기관이 결정되면 풍산개를 이동시킬 계획""이라고 밝혔다. 문 전 대통령 측은 2018년 9월 남북정상회담 뒤 김 위원장이 선물한 곰이와 송강을 정부에 반환하겠다고 전날 밝혔다. 퇴임 전 대통령기록관과 맺은 협약의 후속 조치인 시행령 개정이 이뤄지지 않았기 때문이라는 이유에서였다.박상길기자 sweatsk@dt.co.kr ",https://v.daum.net/v/20221109141611188
정치,"輿 국조 거부에 박홍근 ""국민 슬픔 안중에 없고 대통령실 입만 바라봐"""," [파이낸셜뉴스] 박홍근 더불어민주당 원내대표가 9일 국민의힘이 이태원 참사 국정조사 추진에 불참하자 ""국민 슬픔과 분노는 안중에도 없고 오직 대통령실 입만 바라보고 있는 행태가 개탄스럽다""고 비판했다.             박 원내대표는 이날 국회 본청에서 열린 정책의원총회에서 ""국회 민심에 눈 감고 주어진 책무를 다하지 않는 것은 명백한 직무유기""라며 이같이 말했다.  이날 의총 직후 민주당, 정의당, 기본소득당, 무소속 등 범야권은 '이태원 압사 참사'의 진상 규명을 위한 국정조사 요구서를 국회 의안과에 제출하기로 했다.  박 원내대표는 ""국민의힘은 온갖 억지 주장으로 국정조사 방해하고 있다""며 ""국정 무한 책임 있는 집권여당이라면 156명 국민 희생된 참사의 진실 밝히기 위해 특검 국조든 먼저 하자고 제안해야 할 것 아니냐""고 지적했다.  이어 박 원내대표는 ""이태원 참사 규명과 책임자 처벌, 재발 방지 대책 마련까지 국민 의혹과 불신을 하나씩 해소해 나가겠다""며 ""여당의 동참을 거듭 촉구한다""고 했다.  아울러 박 원내대표는 ""대형 참사가 발생한 국가 비상시기에 한 축에서는 진상 규명에 힘을 쏟아야 하지만 한 축에서는 민생 입법 예산 성과를 놓쳐서는 안 된다""며 주요 법안 당론 채택에 ""지혜를 모아달라""고 했다.  민주당은 이날 의총에서 △이태원 참사 국정조사 요구서 △스토킹 피해자 보호 및 지원법 △기초연금법 개정안 △감사원법 개정안 △ 반인권적 국가폭력 공소시효 배제법에 대한 당론 추인을 논의하기로 했다.",https://v.daum.net/v/20221109141557171
정치,윤 대통령 지지율 38.2%…7월 이후 최고치ㅣ알앤써치,"             윤석열 대통령의 국정 수행 지지율이 30% 후반대를 기록하며 7월 이후 최고치라는 여론조사 결과가 오늘(9일) 나왔습니다.            알앤써치가 뉴스핌 의뢰로 지난 5~7일 전국 만 18세 이상 남녀 1023명을 대상으로 조사한 결과에서 윤 대통령의 국정 수행 긍정 평가는 전주 조사 대비 2.7%포인트(p) 상승한 38.2%를 기록했습니다. 부정 평가는 2.1%포인트 하락한 59.4%를 기록했습니다.  윤 대통령 국정 수행에 대한 긍정 평가는 지난 7월 이후 최고치를 기록했습니다. 부정 평가 역시 50%대로 내려온 건 7월 이후 처음이었습니다. 지역별로는 서울(4.5%포인트↑), 강원·제주(13.1%포인트↑), 부산·울산·경남(8.4%포인트↑), 전남·광주·전북(2.5%포인트↑) 등에서 올랐습니다. 반면 대구·경북 지역에서는 8.1%포인트 하락했습니다.  연령대별로는 30대에서 전주 대비 9.1%포인트 급증했습니다. 이어 18세 이상~20대(5.75%포인트↑), 40대(5.0%포인트↑) 등에서 상승세를 보였습니다.  60세 이상에서는 4.3%포인트 하락했습니다. 정당 지지율 조사에서는 국민의힘이 2주 연속 하락하며 37.6%를 기록했습니다. 더불어민주당은 2주 연속 지지율이 소폭 상승해 39.4%까지 올랐습니다. 이번 여론조사는 성별·연령대별·지역별 인구 구성비에 따른 비례할당으로 추출된 표본을 구조화된 설문지를 이용한 무선전화 RDD 100% 자동응답 방식으로 이뤄졌습니다. 응답률은 2.7%, 표본오차는 95%의 신뢰수준에 ±3.1%포인트입니다.  자세한 내용은 중앙선거여론조사심의위원회 홈페이지를 참고하면 됩니다. ",https://v.daum.net/v/20221109141538148
정치,"정청래, 김기현에 ""갑툭튀 의원이 말 거칠어..국힘 대표 나가려나""","            [파이낸셜뉴스]             정청래 더불어민주당 의원이 김기현 국민의힘 의원을 향해 “꼭 국민의힘 대표가 되시라”고 비꼬아 응원했다.                         김 의원은 지난 3일에도 “자신을 둘러싼 온갖 비리 의혹으로 죽상이던 이재명 더불어민주당 대표가 요즘 얼굴에 웃음기가 가득한 모습을 보이고 있다”며 이태원 참사의 책임을 윤석열 대통령과 정부로 돌리며 공세를 취하는 야당의 태도를 비판한 바 있다. 김 의원은 “세월호 아이들에게 ‘고맙다’고 한 문재인 전 대통령 모습과 오버랩이 된다”고도 했다.             정 의원은 7일 자신의 페이스북에 “국민의힘 김기현 의원을 응원한다”며 이같이 말했다.  그는 “국민의힘 대표를 나가려나 갑툭튀 듣보잡 김기현 의원의 말이 거칠어지고 있다. 거의 망언 수준이다”라며 “죽상, 추태, 오물...그의 입에서 악취가 진동한다”라며 김 의원을 강도 높게 비판했다.  정 의원의 강도 높은 비판은 ‘이태원 참사‘ 국가 애도기간 마지막 날인 지난 5일 서울 도심 곳곳에서 진행된 대규모 추모 촛불집회 관련해 김기현 국민의힘 의원이 “안타까운 죽음을 정치권력 찬탈의 희생물로 삼으려는 ‘촛불 호소인’들의 선동은 고인과 유족들에 대한 2차 가해행위이며 촛불에 대한 모독”이라고 비판한 것을 두고 나온 것이다.  이에 정 의원은 차기 국민의힘 당 대표 관련 여론조사 결과를 공유하며 “(김 의원이) 만약 당대표에 나간다면, 아직 유승민 전 의원 등에 비해 지지율이 미약한데, 김기현의원 더 분발하기 바란다”며 “계속 혐오발언 하시고 유체이탈 화법으로 대중의 눈과 귀를 붙잡의시라”고 지적했다.  그러면서 “국민의힘 대표가 돼서 국민의힘을 극보수로 인도하시라”며 “그러면 우리로서는 땡큐다”라고 했다.  정 의원은 “그런데 불만이 하나 있다. 황교안 전 대표처럼 삭발도 하고 단식하고 태극기 부대하고 손 잡아라. 그래야 대표가 된다. 지금까지의 혐오발언만으로는 부족하다”라며 “김기현의원의 망언을 응원한다”고 덧붙였다.",https://v.daum.net/v/20221109141531138
정치,"하이퍼튜브 예타 탈락에…전북도 ""지적 보완해 연말 재신청""","(전주=연합뉴스) 정경재 기자 = 전북도는 새만금 하이퍼튜브 종합시험센터 사업이 정부 예비타당성 대상 선정 심의에서 탈락한 데 대해 재신청을 준비하겠다고 9일 밝혔다. 도 관계자는 ""국토교통부와 함께 과학기술정보통신부의 지적 사항을 분석하고 있다""며 ""이달 말까지 사업 당위성과 중요성 등을 보완해 연말 4분기 예타 대상 심의를 다시 신청하겠다""고 말했다. 그러면서 ""통과 여부를 장담할 수는 없지만, 미래 기술인 하이퍼튜브 가능성에 대한 공감대가 형성된 만큼 의미 있는 결과를 낼 수 있도록 준비하겠다""고 덧붙였다. 도에 따르면 과학기술정보통신부는 최근 제8회 국가연구개발사업평가 총괄위원회에서 달 탐사 2단계와 바이오 빅데이터 구축 등 5개 사업을 3분기 예타 대상 사업으로 선정했다. 국토부가 신청한 새만금 하이퍼튜브 종합시험센터 구축사업은 구체적 로드맵 제시 부족과 연구·개발 근거 미비 등의 사유로 대상에 오르지 못했다. 김정기 도의원은 전날 도정질문에서 예타 대상 선정 실패 원인을 ""전북도의 전략 부재""라고 꼬집으며 ""안일한 인식을 버리고 적극적으로 대응하라""고 주문했다. 새만금 농생명용지에 9천46억원을 들여 조성 예정인 하이퍼튜브 종합시험센터는 공기저항이 거의 없는 아진공(0.001 기압 수준) 상태에서 자기력으로 차량을 추진·부상시켜 시속 800㎞ 이상의 육상교통 시스템을 구축하는 것을 목표로 한다. 국토부와 전북도는 2024년부터 본격적 연구개발에 착수하려 했으나 3분기 예타 대상 심의 탈락으로 사업에 차질을 빚게 됐다. jaya@yna.co.kr ▶제보는 카톡 okjebo",https://v.daum.net/v/20221109141519123
